,LineNos,Lines,Speakers
828,2.4.88,"That young swain that you saw here but erewhile,",CORIN
829,2.4.89,That little cares for buying any thing.,CORIN
830,2.4.90,"I pray thee, if it stand with honesty,",ROSALIND
831,2.4.91,"Buy thou the cottage, pasture and the flock,",ROSALIND
832,2.4.92,And thou shalt have to pay for it of us.,ROSALIND
833,2.4.93,And we will mend thy wages. I like this place.,CELIA
834,2.4.94,And willingly could waste my time in it.,CELIA
835,2.4.95,Assuredly the thing is to be sold:,CORIN
836,2.4.96,Go with me: if you like upon report,CORIN
837,2.4.97,"The soil, the profit and this kind of life,",CORIN
838,2.4.98,I will your very faithful feeder be,CORIN
839,2.4.99,And buy it with your gold right suddenly.,CORIN
840,2.5.1,SONG.,CORIN
841,2.5.2,Under the greenwood tree,AMIENS
842,2.5.3,"Who loves to lie with me,",AMIENS
843,2.5.4,And turn his merry note,AMIENS
844,2.5.5,"Unto the sweet bird's throat,",AMIENS
845,2.5.6,"Come hither, come hither, come hither:",AMIENS
846,2.5.7,Here shall he see No enemy,AMIENS
847,2.5.8,But winter and rough weather.,AMIENS
848,2.5.9,"More, more, I prithee, more.",JAQUES
849,2.5.10,"It will make you melancholy, Monsieur Jaques.",AMIENS
850,2.5.11,"I thank it. More, I prithee, more. I can suck",JAQUES
851,2.5.12,"melancholy out of a song, as a weasel sucks eggs.",JAQUES
852,2.5.13,"More, I prithee, more.",JAQUES
853,2.5.14,My voice is ragged: I know I cannot please you.,AMIENS
854,2.5.15,I do not desire you to please me; I do desire you to,JAQUES
855,2.5.16,"sing. Come, more; another stanzo: call you 'em stanzos?",JAQUES
856,2.5.17,"What you will, Monsieur Jaques.",AMIENS
857,2.5.18,"Nay, I care not for their names; they owe me",JAQUES
858,2.5.19,nothing. Will you sing?,JAQUES
859,2.5.20,More at your request than to please myself.,AMIENS
860,2.5.21,"Well then, if ever I thank any man, I'll thank you;",JAQUES
861,2.5.22,but that they call compliment is like the encounter,JAQUES
862,2.5.23,"of two dog-apes, and when a man thanks me heartily,",JAQUES
863,2.5.24,methinks I have given him a penny and he renders me,JAQUES
864,2.5.25,"the beggarly thanks. Come, sing; and you that will",JAQUES
865,2.5.26,"not, hold your tongues.",JAQUES
866,2.5.27,"Well, I'll end the song. Sirs, cover the while; the",AMIENS
867,2.5.28,duke will drink under this tree. He hath been all,AMIENS
868,2.5.29,this day to look you.,AMIENS
869,2.5.30,And I have been all this day to avoid him. He is,JAQUES
870,2.5.31,too disputable for my company: I think of as many,JAQUES
871,2.5.32,"matters as he, but I give heaven thanks and make no",JAQUES
872,2.5.33,"boast of them. Come, warble, come.",JAQUES
873,2.5.34,SONG.,JAQUES
874,2.5.35,Who doth ambition shun,JAQUES
875,2.5.36,"And loves to live i' the sun,",JAQUES
876,2.5.37,Seeking the food he eats,JAQUES
877,2.5.38,"And pleased with what he gets,",JAQUES
878,2.5.39,"Come hither, come hither, come hither:",JAQUES
879,2.5.40,Here shall he see No enemy,JAQUES
880,2.5.41,But winter and rough weather.,JAQUES
881,2.5.42,I'll give you a verse to this note that I made,JAQUES
882,2.5.43,yesterday in despite of my invention.,JAQUES
883,2.5.44,And I'll sing it.,AMIENS
884,2.5.45,Thus it goes:--,JAQUES
885,2.5.46,If it do come to pass,JAQUES
886,2.5.47,"That any man turn ass,",JAQUES
887,2.5.48,"Leaving his wealth and ease,",JAQUES
888,2.5.49,"A stubborn will to please,",JAQUES
889,2.5.50,"Ducdame, ducdame, ducdame:",JAQUES
890,2.5.51,Here shall he see,JAQUES
891,2.5.52,"Gross fools as he,",JAQUES
892,2.5.53,An if he will come to me.,JAQUES
893,2.5.54,What's that 'ducdame'?,AMIENS
894,2.5.55,"'Tis a Greek invocation, to call fools into a",JAQUES
895,2.5.56,"circle. I'll go sleep, if I can; if I cannot, I'll",JAQUES
896,2.5.57,rail against all the first-born of Egypt.,JAQUES
897,2.5.58,And I'll go seek the duke: his banquet is prepared.,AMIENS
898,2.6.1,"Dear master, I can go no further. O, I die for food!",ADAM
899,2.6.2,"Here lie I down, and measure out my grave. Farewell,",ADAM
900,2.6.3,kind master.,ADAM
901,2.6.4,"Why, how now, Adam! no greater heart in thee? Live",ORLANDO
902,2.6.5,a little; comfort a little; cheer thyself a little.,ORLANDO
903,2.6.6,"If this uncouth forest yield any thing savage, I",ORLANDO
904,2.6.7,will either be food for it or bring it for food to,ORLANDO
905,2.6.8,thee. Thy conceit is nearer death than thy powers.,ORLANDO
906,2.6.9,For my sake be comfortable; hold death awhile at,ORLANDO
907,2.6.10,the arm's end: I will here be with thee presently;,ORLANDO
908,2.6.11,"and if I bring thee not something to eat, I will",ORLANDO
909,2.6.12,give thee leave to die: but if thou diest before I,ORLANDO
910,2.6.13,"come, thou art a mocker of my labour. Well said!",ORLANDO
911,2.6.14,"thou lookest cheerly, and I'll be with thee quickly.",ORLANDO
912,2.6.15,"Yet thou liest in the bleak air: come, I will bear",ORLANDO
913,2.6.16,thee to some shelter; and thou shalt not die for,ORLANDO
914,2.6.17,"lack of a dinner, if there live any thing in this",ORLANDO
915,2.6.18,"desert. Cheerly, good Adam!",ORLANDO
916,2.7.1,I think he be transform'd into a beast;,DUKE SENIOR
917,2.7.2,For I can no where find him like a man.,DUKE SENIOR
918,2.7.3,"My lord, he is but even now gone hence:",First Lord
919,2.7.4,"Here was he merry, hearing of a song.",First Lord
920,2.7.5,"If he, compact of jars, grow musical,",DUKE SENIOR
921,2.7.6,We shall have shortly discord in the spheres.,DUKE SENIOR
922,2.7.7,"Go, seek him: tell him I would speak with him.",DUKE SENIOR
923,2.7.8,He saves my labour by his own approach.,First Lord
924,2.7.9,"Why, how now, monsieur! what a life is this,",DUKE SENIOR
925,2.7.10,That your poor friends must woo your company?,DUKE SENIOR
926,2.7.11,"What, you look merrily!",DUKE SENIOR
927,2.7.12,"A fool, a fool! I met a fool i' the forest,",JAQUES
928,2.7.13,A motley fool; a miserable world!,JAQUES
929,2.7.14,"As I do live by food, I met a fool",JAQUES
930,2.7.15,"Who laid him down and bask'd him in the sun,",JAQUES
931,2.7.16,"And rail'd on Lady Fortune in good terms,",JAQUES
932,2.7.17,In good set terms and yet a motley fool.,JAQUES
933,2.7.18,"'Good morrow, fool,' quoth I. 'No, sir,' quoth he,",JAQUES
934,2.7.19,'Call me not fool till heaven hath sent me fortune:',JAQUES
935,2.7.20,"And then he drew a dial from his poke,",JAQUES
936,2.7.21,"And, looking on it with lack-lustre eye,",JAQUES
937,2.7.22,"Says very wisely, 'It is ten o'clock:",JAQUES
938,2.7.23,"Thus we may see,' quoth he, 'how the world wags:",JAQUES
939,2.7.24,"'Tis but an hour ago since it was nine,",JAQUES
940,2.7.25,And after one hour more 'twill be eleven;,JAQUES
941,2.7.26,"And so, from hour to hour, we ripe and ripe,",JAQUES
942,2.7.27,"And then, from hour to hour, we rot and rot;",JAQUES
943,2.7.28,And thereby hangs a tale.' When I did hear,JAQUES
944,2.7.29,"The motley fool thus moral on the time,",JAQUES
945,2.7.30,"My lungs began to crow like chanticleer,",JAQUES
946,2.7.31,"That fools should be so deep-contemplative,",JAQUES
947,2.7.32,And I did laugh sans intermission,JAQUES
948,2.7.33,An hour by his dial. O noble fool!,JAQUES
949,2.7.34,A worthy fool! Motley's the only wear.,JAQUES
950,2.7.35,What fool is this?,DUKE SENIOR
951,2.7.36,"O worthy fool! One that hath been a courtier,",JAQUES
952,2.7.37,"And says, if ladies be but young and fair,",JAQUES
953,2.7.38,"They have the gift to know it: and in his brain,",JAQUES
954,2.7.39,Which is as dry as the remainder biscuit,JAQUES
955,2.7.40,"After a voyage, he hath strange places cramm'd",JAQUES
956,2.7.41,"With observation, the which he vents",JAQUES
957,2.7.42,In mangled forms. O that I were a fool!,JAQUES
958,2.7.43,I am ambitious for a motley coat.,JAQUES
959,2.7.44,Thou shalt have one.,DUKE SENIOR
960,2.7.45,It is my only suit;,JAQUES
961,2.7.46,Provided that you weed your better judgments,JAQUES
962,2.7.47,Of all opinion that grows rank in them,JAQUES
963,2.7.48,That I am wise. I must have liberty,JAQUES
964,2.7.49,"Withal, as large a charter as the wind,",JAQUES
965,2.7.50,To blow on whom I please; for so fools have;,JAQUES
966,2.7.51,"And they that are most galled with my folly,",JAQUES
967,2.7.52,"They most must laugh. And why, sir, must they so?",JAQUES
968,2.7.53,The 'why' is plain as way to parish church:,JAQUES
969,2.7.54,He that a fool doth very wisely hit,JAQUES
970,2.7.55,"Doth very foolishly, although he smart,",JAQUES
971,2.7.56,"Not to seem senseless of the bob: if not,",JAQUES
972,2.7.57,The wise man's folly is anatomized,JAQUES
973,2.7.58,Even by the squandering glances of the fool.,JAQUES
974,2.7.59,Invest me in my motley; give me leave,JAQUES
975,2.7.60,"To speak my mind, and I will through and through",JAQUES
976,2.7.61,"Cleanse the foul body of the infected world,",JAQUES
977,2.7.62,If they will patiently receive my medicine.,JAQUES
978,2.7.63,Fie on thee! I can tell what thou wouldst do.,DUKE SENIOR
979,2.7.64,"What, for a counter, would I do but good?",JAQUES
980,2.7.65,"Most mischievous foul sin, in chiding sin:",DUKE SENIOR
981,2.7.66,"For thou thyself hast been a libertine,",DUKE SENIOR
982,2.7.67,As sensual as the brutish sting itself;,DUKE SENIOR
983,2.7.68,"And all the embossed sores and headed evils,",DUKE SENIOR
984,2.7.69,"That thou with licence of free foot hast caught,",DUKE SENIOR
985,2.7.70,Wouldst thou disgorge into the general world.,DUKE SENIOR
986,2.7.71,"Why, who cries out on pride,",JAQUES
987,2.7.72,That can therein tax any private party?,JAQUES
988,2.7.73,"Doth it not flow as hugely as the sea,",JAQUES
989,2.7.74,Till that the weary very means do ebb?,JAQUES
990,2.7.75,"What woman in the city do I name,",JAQUES
991,2.7.76,When that I say the city-woman bears,JAQUES
992,2.7.77,The cost of princes on unworthy shoulders?,JAQUES
993,2.7.78,"Who can come in and say that I mean her,",JAQUES
994,2.7.79,When such a one as she such is her neighbour?,JAQUES
995,2.7.80,Or what is he of basest function,JAQUES
996,2.7.81,"That says his bravery is not of my cost,",JAQUES
997,2.7.82,"Thinking that I mean him, but therein suits",JAQUES
998,2.7.83,His folly to the mettle of my speech?,JAQUES
999,2.7.84,There then; how then? what then? Let me see wherein,JAQUES
1000,2.7.85,"My tongue hath wrong'd him: if it do him right,",JAQUES
1001,2.7.86,"Then he hath wrong'd himself; if he be free,",JAQUES
1002,2.7.87,"Why then my taxing like a wild-goose flies,",JAQUES
1003,2.7.88,Unclaim'd of any man. But who comes here?,JAQUES
1004,2.7.89,"Forbear, and eat no more.",ORLANDO
1005,2.7.90,"Why, I have eat none yet.",JAQUES
1006,2.7.91,"Nor shalt not, till necessity be served.",ORLANDO
1007,2.7.92,Of what kind should this cock come of?,JAQUES
1008,2.7.93,"Art thou thus bolden'd, man, by thy distress,",DUKE SENIOR
1009,2.7.94,"Or else a rude despiser of good manners,",DUKE SENIOR
1010,2.7.95,That in civility thou seem'st so empty?,DUKE SENIOR
1011,2.7.96,You touch'd my vein at first: the thorny point,ORLANDO
1012,2.7.97,Of bare distress hath ta'en from me the show,ORLANDO
1013,2.7.98,Of smooth civility: yet am I inland bred,ORLANDO
1014,2.7.99,"And know some nurture. But forbear, I say:",ORLANDO
1015,2.7.100,He dies that touches any of this fruit,ORLANDO
1016,2.7.101,Till I and my affairs are answered.,ORLANDO
1017,2.7.102,"An you will not be answered with reason, I must die.",JAQUES
1018,2.7.103,What would you have? Your gentleness shall force,DUKE SENIOR
1019,2.7.104,More than your force move us to gentleness.,DUKE SENIOR
1020,2.7.105,I almost die for food; and let me have it.,ORLANDO
1021,2.7.106,"Sit down and feed, and welcome to our table.",DUKE SENIOR
1022,2.7.107,"Speak you so gently? Pardon me, I pray you:",ORLANDO
1023,2.7.108,I thought that all things had been savage here;,ORLANDO
1024,2.7.109,And therefore put I on the countenance,ORLANDO
1025,2.7.110,Of stern commandment. But whate'er you are,ORLANDO
1026,2.7.111,"That in this desert inaccessible,",ORLANDO
1027,2.7.112,"Under the shade of melancholy boughs,",ORLANDO
1028,2.7.113,Lose and neglect the creeping hours of time,ORLANDO
1029,2.7.114,"If ever you have look'd on better days,",ORLANDO
1030,2.7.115,"If ever been where bells have knoll'd to church,",ORLANDO
1031,2.7.116,"If ever sat at any good man's feast,",ORLANDO
1032,2.7.117,If ever from your eyelids wiped a tear,ORLANDO
1033,2.7.118,"And know what 'tis to pity and be pitied,",ORLANDO
1034,2.7.119,Let gentleness my strong enforcement be:,ORLANDO
1035,2.7.120,"In the which hope I blush, and hide my sword.",ORLANDO
1036,2.7.121,"True is it that we have seen better days,",DUKE SENIOR
1037,2.7.122,And have with holy bell been knoll'd to church,DUKE SENIOR
1038,2.7.123,And sat at good men's feasts and wiped our eyes,DUKE SENIOR
1039,2.7.124,Of drops that sacred pity hath engender'd:,DUKE SENIOR
1040,2.7.125,And therefore sit you down in gentleness,DUKE SENIOR
1041,2.7.126,And take upon command what help we have,DUKE SENIOR
1042,2.7.127,That to your wanting may be minister'd.,DUKE SENIOR
1043,2.7.128,"Then but forbear your food a little while,",ORLANDO
1044,2.7.129,"Whiles, like a doe, I go to find my fawn",ORLANDO
1045,2.7.130,"And give it food. There is an old poor man,",ORLANDO
1046,2.7.131,Who after me hath many a weary step,ORLANDO
1047,2.7.132,"Limp'd in pure love: till he be first sufficed,",ORLANDO
1048,2.7.133,"Oppress'd with two weak evils, age and hunger,",ORLANDO
1049,2.7.134,I will not touch a bit.,ORLANDO
1050,2.7.135,"Go find him out,",DUKE SENIOR
1051,2.7.136,And we will nothing waste till you return.,DUKE SENIOR
1052,2.7.137,I thank ye; and be blest for your good comfort!,ORLANDO
1053,2.7.138,Thou seest we are not all alone unhappy:,DUKE SENIOR
1054,2.7.139,This wide and universal theatre,DUKE SENIOR
1055,2.7.140,Presents more woeful pageants than the scene,DUKE SENIOR
1056,2.7.141,Wherein we play in.,DUKE SENIOR
1057,2.7.142,"All the world's a stage,",JAQUES
1058,2.7.143,And all the men and women merely players:,JAQUES
1059,2.7.144,They have their exits and their entrances;,JAQUES
1060,2.7.145,"And one man in his time plays many parts,",JAQUES
1061,2.7.146,"His acts being seven ages. At first the infant,",JAQUES
1062,2.7.147,Mewling and puking in the nurse's arms.,JAQUES
1063,2.7.148,"And then the whining school-boy, with his satchel",JAQUES
1064,2.7.149,"And shining morning face, creeping like snail",JAQUES
1065,2.7.150,"Unwillingly to school. And then the lover,",JAQUES
1066,2.7.151,"Sighing like furnace, with a woeful ballad",JAQUES
1067,2.7.152,"Made to his mistress' eyebrow. Then a soldier,",JAQUES
1068,2.7.153,"Full of strange oaths and bearded like the pard,",JAQUES
1069,2.7.154,"Jealous in honour, sudden and quick in quarrel,",JAQUES
1070,2.7.155,Seeking the bubble reputation,JAQUES
1071,2.7.156,"Even in the cannon's mouth. And then the justice,",JAQUES
1072,2.7.157,"In fair round belly with good capon lined,",JAQUES
1073,2.7.158,"With eyes severe and beard of formal cut,",JAQUES
1074,2.7.159,Full of wise saws and modern instances;,JAQUES
1075,2.7.160,And so he plays his part. The sixth age shifts,JAQUES
1076,2.7.161,"Into the lean and slipper'd pantaloon,",JAQUES
1077,2.7.162,"With spectacles on nose and pouch on side,",JAQUES
1078,2.7.163,"His youthful hose, well saved, a world too wide",JAQUES
1079,2.7.164,"For his shrunk shank; and his big manly voice,",JAQUES
1080,2.7.165,"Turning again toward childish treble, pipes",JAQUES
1081,2.7.166,"And whistles in his sound. Last scene of all,",JAQUES
1082,2.7.167,"That ends this strange eventful history,",JAQUES
1083,2.7.168,"Is second childishness and mere oblivion,",JAQUES
1084,2.7.169,"Sans teeth, sans eyes, sans taste, sans everything.",JAQUES
1085,2.7.170,"Welcome. Set down your venerable burthen,",DUKE SENIOR
1086,2.7.171,And let him feed.,DUKE SENIOR
1087,2.7.172,I thank you most for him.,ORLANDO
1088,2.7.173,So had you need:,ADAM
1089,2.7.174,I scarce can speak to thank you for myself.,ADAM
1090,2.7.175,Welcome; fall to: I will not trouble you,DUKE SENIOR
1091,2.7.176,"As yet, to question you about your fortunes.",DUKE SENIOR
1092,2.7.177,"Give us some music; and, good cousin, sing.",DUKE SENIOR
1093,2.7.178,SONG.,DUKE SENIOR
1094,2.7.179,"Blow, blow, thou winter wind.",AMIENS
1095,2.7.180,Thou art not so unkind,AMIENS
1096,2.7.181,As man's ingratitude;,AMIENS
1097,2.7.182,"Thy tooth is not so keen,",AMIENS
1098,2.7.183,"Because thou art not seen,",AMIENS
1099,2.7.184,Although thy breath be rude.,AMIENS
1100,2.7.185,"Heigh-ho! sing, heigh-ho! unto the green holly:",AMIENS
1101,2.7.186,"Most friendship is feigning, most loving mere folly:",AMIENS
1102,2.7.187,"Then, heigh-ho, the holly!",AMIENS
1103,2.7.188,This life is most jolly.,AMIENS
1104,2.7.189,"Freeze, freeze, thou bitter sky,",AMIENS
1105,2.7.190,That dost not bite so nigh,AMIENS
1106,2.7.191,As benefits forgot:,AMIENS
1107,2.7.192,"Though thou the waters warp,",AMIENS
1108,2.7.193,Thy sting is not so sharp,AMIENS
1109,2.7.194,As friend remember'd not.,AMIENS
1110,2.7.195,"Heigh-ho! sing,  &amp; c.",AMIENS
1111,2.7.196,"If that you were the good Sir Rowland's son,",DUKE SENIOR
1112,2.7.197,"As you have whisper'd faithfully you were,",DUKE SENIOR
1113,2.7.198,And as mine eye doth his effigies witness,DUKE SENIOR
1114,2.7.199,"Most truly limn'd and living in your face,",DUKE SENIOR
1115,2.7.200,Be truly welcome hither: I am the duke,DUKE SENIOR
1116,2.7.201,"That loved your father: the residue of your fortune,",DUKE SENIOR
1117,2.7.202,"Go to my cave and tell me. Good old man,",DUKE SENIOR
1118,2.7.203,Thou art right welcome as thy master is.,DUKE SENIOR
1119,2.7.204,"Support him by the arm. Give me your hand,",DUKE SENIOR
1120,2.7.205,And let me all your fortunes understand.,DUKE SENIOR
1121,3.1.1,"Not see him since? Sir, sir, that cannot be:",DUKE FREDERICK
1122,3.1.2,"But were I not the better part made mercy,",DUKE FREDERICK
1123,3.1.3,I should not seek an absent argument,DUKE FREDERICK
1124,3.1.4,"Of my revenge, thou present. But look to it:",DUKE FREDERICK
1125,3.1.5,"Find out thy brother, wheresoe'er he is;",DUKE FREDERICK
1126,3.1.6,Seek him with candle; bring him dead or living,DUKE FREDERICK
1127,3.1.7,"Within this twelvemonth, or turn thou no more",DUKE FREDERICK
1128,3.1.8,To seek a living in our territory.,DUKE FREDERICK
1129,3.1.9,Thy lands and all things that thou dost call thine,DUKE FREDERICK
1130,3.1.10,"Worth seizure do we seize into our hands,",DUKE FREDERICK
1131,3.1.11,Till thou canst quit thee by thy brothers mouth,DUKE FREDERICK
1132,3.1.12,Of what we think against thee.,DUKE FREDERICK
1133,3.1.13,O that your highness knew my heart in this!,OLIVER
1134,3.1.14,I never loved my brother in my life.,OLIVER
1135,3.1.15,"More villain thou. Well, push him out of doors;",DUKE FREDERICK
1136,3.1.16,And let my officers of such a nature,DUKE FREDERICK
1137,3.1.17,Make an extent upon his house and lands:,DUKE FREDERICK
1138,3.1.18,Do this expediently and turn him going.,DUKE FREDERICK
1139,3.2.1,"Hang there, my verse, in witness of my love:",ORLANDO
1140,3.2.2,"And thou, thrice-crowned queen of night, survey",ORLANDO
1141,3.2.3,"With thy chaste eye, from thy pale sphere above,",ORLANDO
1142,3.2.4,Thy huntress' name that my full life doth sway.,ORLANDO
1143,3.2.5,O Rosalind! these trees shall be my books,ORLANDO
1144,3.2.6,And in their barks my thoughts I'll character;,ORLANDO
1145,3.2.7,That every eye which in this forest looks,ORLANDO
1146,3.2.8,Shall see thy virtue witness'd every where.,ORLANDO
1147,3.2.9,"Run, run, Orlando; carve on every tree",ORLANDO
1148,3.2.10,"The fair, the chaste and unexpressive she.",ORLANDO
1149,3.2.11,"And how like you this shepherd's life, Master Touchstone?",CORIN
1150,3.2.12,"Truly, shepherd, in respect of itself, it is a good",TOUCHSTONE
1151,3.2.13,"life, but in respect that it is a shepherd's life,",TOUCHSTONE
1152,3.2.14,"it is naught. In respect that it is solitary, I",TOUCHSTONE
1153,3.2.15,like it very well; but in respect that it is,TOUCHSTONE
1154,3.2.16,"private, it is a very vile life. Now, in respect it",TOUCHSTONE
1155,3.2.17,"is in the fields, it pleaseth me well; but in",TOUCHSTONE
1156,3.2.18,"respect it is not in the court, it is tedious. As",TOUCHSTONE
1157,3.2.19,"is it a spare life, look you, it fits my humour well;",TOUCHSTONE
1158,3.2.20,"but as there is no more plenty in it, it goes much",TOUCHSTONE
1159,3.2.21,"against my stomach. Hast any philosophy in thee, shepherd?",TOUCHSTONE
1160,3.2.22,No more but that I know the more one sickens the,CORIN
1161,3.2.23,"worse at ease he is; and that he that wants money,",CORIN
1162,3.2.24,means and content is without three good friends;,CORIN
1163,3.2.25,that the property of rain is to wet and fire to,CORIN
1164,3.2.26,"burn; that good pasture makes fat sheep, and that a",CORIN
1165,3.2.27,great cause of the night is lack of the sun; that,CORIN
1166,3.2.28,he that hath learned no wit by nature nor art may,CORIN
1167,3.2.29,complain of good breeding or comes of a very dull kindred.,CORIN
1168,3.2.30,Such a one is a natural philosopher. Wast ever in,TOUCHSTONE
1169,3.2.31,"court, shepherd?",TOUCHSTONE
1170,3.2.32,"No, truly.",CORIN
1171,3.2.33,Then thou art damned.,TOUCHSTONE
1172,3.2.34,"Nay, I hope.",CORIN
1173,3.2.35,"Truly, thou art damned like an ill-roasted egg, all",TOUCHSTONE
1174,3.2.36,on one side.,TOUCHSTONE
1175,3.2.37,For not being at court? Your reason.,CORIN
1176,3.2.38,"Why, if thou never wast at court, thou never sawest",TOUCHSTONE
1177,3.2.39,"good manners; if thou never sawest good manners,",TOUCHSTONE
1178,3.2.40,then thy manners must be wicked; and wickedness is,TOUCHSTONE
1179,3.2.41,"sin, and sin is damnation. Thou art in a parlous",TOUCHSTONE
1180,3.2.42,"state, shepherd.",TOUCHSTONE
1181,3.2.43,"Not a whit, Touchstone: those that are good manners",CORIN
1182,3.2.44,at the court are as ridiculous in the country as the,CORIN
1183,3.2.45,behavior of the country is most mockable at the,CORIN
1184,3.2.46,"court. You told me you salute not at the court, but",CORIN
1185,3.2.47,you kiss your hands: that courtesy would be,CORIN
1186,3.2.48,"uncleanly, if courtiers were shepherds.",CORIN
1187,3.2.49,"Instance, briefly; come, instance.",TOUCHSTONE
1188,3.2.50,"Why, we are still handling our ewes, and their",CORIN
1189,3.2.51,"fells, you know, are greasy.",CORIN
1190,3.2.52,"Why, do not your courtier's hands sweat? and is not",TOUCHSTONE
1191,3.2.53,the grease of a mutton as wholesome as the sweat of,TOUCHSTONE
1192,3.2.54,"a man? Shallow, shallow. A better instance, I say; come.",TOUCHSTONE
1193,3.2.55,"Besides, our hands are hard.",CORIN
1194,3.2.56,Your lips will feel them the sooner. Shallow again.,TOUCHSTONE
1195,3.2.57,"A more sounder instance, come.",TOUCHSTONE
1196,3.2.58,And they are often tarred over with the surgery of,CORIN
1197,3.2.59,our sheep: and would you have us kiss tar? The,CORIN
1198,3.2.60,courtier's hands are perfumed with civet.,CORIN
1199,3.2.61,"Most shallow man! thou worms-meat, in respect of a",TOUCHSTONE
1200,3.2.62,"good piece of flesh indeed! Learn of the wise, and",TOUCHSTONE
1201,3.2.63,"perpend: civet is of a baser birth than tar, the",TOUCHSTONE
1202,3.2.64,"very uncleanly flux of a cat. Mend the instance, shepherd.",TOUCHSTONE
1203,3.2.65,You have too courtly a wit for me: I'll rest.,CORIN
1204,3.2.66,"Wilt thou rest damned? God help thee, shallow man!",TOUCHSTONE
1205,3.2.67,God make incision in thee! thou art raw.,TOUCHSTONE
1206,3.2.68,"Sir, I am a true labourer: I earn that I eat, get",CORIN
1207,3.2.69,"that I wear, owe no man hate, envy no man's",CORIN
1208,3.2.70,"happiness, glad of other men's good, content with my",CORIN
1209,3.2.71,"harm, and the greatest of my pride is to see my ewes",CORIN
1210,3.2.72,graze and my lambs suck.,CORIN
1211,3.2.73,"That is another simple sin in you, to bring the ewes",TOUCHSTONE
1212,3.2.74,and the rams together and to offer to get your,TOUCHSTONE
1213,3.2.75,living by the copulation of cattle; to be bawd to a,TOUCHSTONE
1214,3.2.76,"bell-wether, and to betray a she-lamb of a",TOUCHSTONE
1215,3.2.77,"twelvemonth to a crooked-pated, old, cuckoldly ram,",TOUCHSTONE
1216,3.2.78,out of all reasonable match. If thou beest not,TOUCHSTONE
1217,3.2.79,"damned for this, the devil himself will have no",TOUCHSTONE
1218,3.2.80,shepherds; I cannot see else how thou shouldst,TOUCHSTONE
1219,3.2.81,'scape.,TOUCHSTONE
1220,3.2.82,"Here comes young Master Ganymede, my new mistress's brother.",CORIN
1221,3.2.83,"     From the east to western Ind,",ROSALIND
1222,3.2.84,No jewel is like Rosalind.,ROSALIND
1223,3.2.85,"Her worth, being mounted on the wind,",ROSALIND
1224,3.2.86,Through all the world bears Rosalind.,ROSALIND
1225,3.2.87,All the pictures fairest lined,ROSALIND
1226,3.2.88,Are but black to Rosalind.,ROSALIND
1227,3.2.89,Let no fair be kept in mind,ROSALIND
1228,3.2.90,But the fair of Rosalind.,ROSALIND
1229,3.2.91,"I'll rhyme you so eight years together, dinners and",TOUCHSTONE
1230,3.2.92,suppers and sleeping-hours excepted: it is the,TOUCHSTONE
1231,3.2.93,right butter-women's rank to market.,TOUCHSTONE
1232,3.2.94,"Out, fool!",ROSALIND
1233,3.2.95,For a taste:,TOUCHSTONE
1234,3.2.96,"If a hart do lack a hind,",TOUCHSTONE
1235,3.2.97,Let him seek out Rosalind.,TOUCHSTONE
1236,3.2.98,"If the cat will after kind,",TOUCHSTONE
1237,3.2.99,So be sure will Rosalind.,TOUCHSTONE
1238,3.2.100,"Winter garments must be lined,",TOUCHSTONE
1239,3.2.101,So must slender Rosalind.,TOUCHSTONE
1240,3.2.102,They that reap must sheaf and bind;,TOUCHSTONE
1241,3.2.103,Then to cart with Rosalind.,TOUCHSTONE
1242,3.2.104,"Sweetest nut hath sourest rind,",TOUCHSTONE
1243,3.2.105,Such a nut is Rosalind.,TOUCHSTONE
1244,3.2.106,He that sweetest rose will find,TOUCHSTONE
1245,3.2.107,Must find love's prick and Rosalind.,TOUCHSTONE
1246,3.2.108,This is the very false gallop of verses: why do you,TOUCHSTONE
1247,3.2.109,infect yourself with them?,TOUCHSTONE
1248,3.2.110,"Peace, you dull fool! I found them on a tree.",ROSALIND
