,LineNos,Lines,Speakers
1659,3.4.19,Do you think so?,ROSALIND
1660,3.4.20,Yes; I think he is not a pick-purse nor a,CELIA
1661,3.4.21,"horse-stealer, but for his verity in love, I do",CELIA
1662,3.4.22,think him as concave as a covered goblet or a,CELIA
1663,3.4.23,worm-eaten nut.,CELIA
1664,3.4.24,Not true in love?,ROSALIND
1665,3.4.25,"Yes, when he is in; but I think he is not in.",CELIA
1666,3.4.26,You have heard him swear downright he was.,ROSALIND
1667,3.4.27,"'Was' is not 'is:' besides, the oath of a lover is",CELIA
1668,3.4.28,no stronger than the word of a tapster; they are,CELIA
1669,3.4.29,both the confirmer of false reckonings. He attends,CELIA
1670,3.4.30,here in the forest on the duke your father.,CELIA
1671,3.4.31,I met the duke yesterday and had much question with,ROSALIND
1672,3.4.32,him: he asked me of what parentage I was; I told,ROSALIND
1673,3.4.33,"him, of as good as he; so he laughed and let me go.",ROSALIND
1674,3.4.34,"But what talk we of fathers, when there is such a",ROSALIND
1675,3.4.35,man as Orlando?,ROSALIND
1676,3.4.36,"O, that's a brave man! he writes brave verses,",CELIA
1677,3.4.37,"speaks brave words, swears brave oaths and breaks",CELIA
1678,3.4.38,"them bravely, quite traverse, athwart the heart of",CELIA
1679,3.4.39,"his lover; as a puisny tilter, that spurs his horse",CELIA
1680,3.4.40,"but on one side, breaks his staff like a noble",CELIA
1681,3.4.41,goose: but all's brave that youth mounts and folly,CELIA
1682,3.4.42,guides. Who comes here?,CELIA
1683,3.4.43,"Mistress and master, you have oft inquired",CORIN
1684,3.4.44,"After the shepherd that complain'd of love,",CORIN
1685,3.4.45,"Who you saw sitting by me on the turf,",CORIN
1686,3.4.46,Praising the proud disdainful shepherdess,CORIN
1687,3.4.47,That was his mistress.,CORIN
1688,3.4.48,"Well, and what of him?",CELIA
1689,3.4.49,"If you will see a pageant truly play'd,",CORIN
1690,3.4.50,Between the pale complexion of true love,CORIN
1691,3.4.51,"And the red glow of scorn and proud disdain,",CORIN
1692,3.4.52,"Go hence a little and I shall conduct you,",CORIN
1693,3.4.53,If you will mark it.,CORIN
1694,3.4.54,"O, come, let us remove:",ROSALIND
1695,3.4.55,The sight of lovers feedeth those in love.,ROSALIND
1696,3.4.56,"Bring us to this sight, and you shall say",ROSALIND
1697,3.4.57,I'll prove a busy actor in their play.,ROSALIND
1698,3.5.1,"Sweet Phebe, do not scorn me; do not, Phebe;",SILVIUS
1699,3.5.2,"Say that you love me not, but say not so",SILVIUS
1700,3.5.3,"In bitterness. The common executioner,",SILVIUS
1701,3.5.4,"Whose heart the accustom'd sight of death makes hard,",SILVIUS
1702,3.5.5,Falls not the axe upon the humbled neck,SILVIUS
1703,3.5.6,But first begs pardon: will you sterner be,SILVIUS
1704,3.5.7,Than he that dies and lives by bloody drops?,SILVIUS
1705,3.5.8,I would not be thy executioner:,PHEBE
1706,3.5.9,"I fly thee, for I would not injure thee.",PHEBE
1707,3.5.10,Thou tell'st me there is murder in mine eye:,PHEBE
1708,3.5.11,"'Tis pretty, sure, and very probable,",PHEBE
1709,3.5.12,"That eyes, that are the frail'st and softest things,",PHEBE
1710,3.5.13,"Who shut their coward gates on atomies,",PHEBE
1711,3.5.14,"Should be call'd tyrants, butchers, murderers!",PHEBE
1712,3.5.15,Now I do frown on thee with all my heart;,PHEBE
1713,3.5.16,"And if mine eyes can wound, now let them kill thee:",PHEBE
1714,3.5.17,Now counterfeit to swoon; why now fall down;,PHEBE
1715,3.5.18,"Or if thou canst not, O, for shame, for shame,",PHEBE
1716,3.5.19,"Lie not, to say mine eyes are murderers!",PHEBE
1717,3.5.20,Now show the wound mine eye hath made in thee:,PHEBE
1718,3.5.21,"Scratch thee but with a pin, and there remains",PHEBE
1719,3.5.22,"Some scar of it; lean but upon a rush,",PHEBE
1720,3.5.23,The cicatrice and capable impressure,PHEBE
1721,3.5.24,"Thy palm some moment keeps; but now mine eyes,",PHEBE
1722,3.5.25,"Which I have darted at thee, hurt thee not,",PHEBE
1723,3.5.26,"Nor, I am sure, there is no force in eyes",PHEBE
1724,3.5.27,That can do hurt.,PHEBE
1725,3.5.28,"                  O dear Phebe,",SILVIUS
1726,3.5.29,"If ever,--as that ever may be near,--",SILVIUS
1727,3.5.30,"You meet in some fresh cheek the power of fancy,",SILVIUS
1728,3.5.31,Then shall you know the wounds invisible,SILVIUS
1729,3.5.32,That love's keen arrows make.,SILVIUS
1730,3.5.33,But till that time,PHEBE
1731,3.5.34,"Come not thou near me: and when that time comes,",PHEBE
1732,3.5.35,"Afflict me with thy mocks, pity me not;",PHEBE
1733,3.5.36,As till that time I shall not pity thee.,PHEBE
1734,3.5.37,"And why, I pray you? Who might be your mother,",ROSALIND
1735,3.5.38,"That you insult, exult, and all at once,",ROSALIND
1736,3.5.39,"Over the wretched? What though you have no beauty,--",ROSALIND
1737,3.5.40,"As, by my faith, I see no more in you",ROSALIND
1738,3.5.41,Than without candle may go dark to bed--,ROSALIND
1739,3.5.42,Must you be therefore proud and pitiless?,ROSALIND
1740,3.5.43,"Why, what means this? Why do you look on me?",ROSALIND
1741,3.5.44,I see no more in you than in the ordinary,ROSALIND
1742,3.5.45,"Of nature's sale-work. 'Od's my little life,",ROSALIND
1743,3.5.46,I think she means to tangle my eyes too!,ROSALIND
1744,3.5.47,"No, faith, proud mistress, hope not after it:",ROSALIND
1745,3.5.48,"'Tis not your inky brows, your black silk hair,",ROSALIND
1746,3.5.49,"Your bugle eyeballs, nor your cheek of cream,",ROSALIND
1747,3.5.50,That can entame my spirits to your worship.,ROSALIND
1748,3.5.51,"You foolish shepherd, wherefore do you follow her,",ROSALIND
1749,3.5.52,Like foggy south puffing with wind and rain?,ROSALIND
1750,3.5.53,You are a thousand times a properer man,ROSALIND
1751,3.5.54,Than she a woman: 'tis such fools as you,ROSALIND
1752,3.5.55,That makes the world full of ill-favour'd children:,ROSALIND
1753,3.5.56,"'Tis not her glass, but you, that flatters her;",ROSALIND
1754,3.5.57,And out of you she sees herself more proper,ROSALIND
1755,3.5.58,Than any of her lineaments can show her.,ROSALIND
1756,3.5.59,"But, mistress, know yourself: down on your knees,",ROSALIND
1757,3.5.60,"And thank heaven, fasting, for a good man's love:",ROSALIND
1758,3.5.61,"For I must tell you friendly in your ear,",ROSALIND
1759,3.5.62,Sell when you can: you are not for all markets:,ROSALIND
1760,3.5.63,Cry the man mercy; love him; take his offer:,ROSALIND
1761,3.5.64,"Foul is most foul, being foul to be a scoffer.",ROSALIND
1762,3.5.65,"So take her to thee, shepherd: fare you well.",ROSALIND
1763,3.5.66,"Sweet youth, I pray you, chide a year together:",PHEBE
1764,3.5.67,I had rather hear you chide than this man woo.,PHEBE
1765,3.5.68,He's fallen in love with your foulness and she'll,ROSALIND
1766,3.5.69,"fall in love with my anger. If it be so, as fast as",ROSALIND
1767,3.5.70,"she answers thee with frowning looks, I'll sauce her",ROSALIND
1768,3.5.71,with bitter words. Why look you so upon me?,ROSALIND
1769,3.5.72,For no ill will I bear you.,PHEBE
1770,3.5.73,"I pray you, do not fall in love with me,",ROSALIND
1771,3.5.74,For I am falser than vows made in wine:,ROSALIND
1772,3.5.75,"Besides, I like you not. If you will know my house,",ROSALIND
1773,3.5.76,'Tis at the tuft of olives here hard by.,ROSALIND
1774,3.5.77,"Will you go, sister? Shepherd, ply her hard.",ROSALIND
1775,3.5.78,"Come, sister. Shepherdess, look on him better,",ROSALIND
1776,3.5.79,"And be not proud: though all the world could see,",ROSALIND
1777,3.5.80,None could be so abused in sight as he.,ROSALIND
1778,3.5.81,"Come, to our flock.",ROSALIND
1779,3.5.82,"Dead Shepherd, now I find thy saw of might,",PHEBE
1780,3.5.83,'Who ever loved that loved not at first sight?',PHEBE
1781,3.5.84,"Sweet Phebe,--",SILVIUS
1782,3.5.85,"                  Ha, what say'st thou, Silvius?",PHEBE
1783,3.5.86,"Sweet Phebe, pity me.",SILVIUS
1784,3.5.87,"Why, I am sorry for thee, gentle Silvius.",PHEBE
1785,3.5.88,"Wherever sorrow is, relief would be:",SILVIUS
1786,3.5.89,"If you do sorrow at my grief in love,",SILVIUS
1787,3.5.90,By giving love your sorrow and my grief,SILVIUS
1788,3.5.91,Were both extermined.,SILVIUS
1789,3.5.92,Thou hast my love: is not that neighbourly?,PHEBE
1790,3.5.93,I would have you.,SILVIUS
1791,3.5.94,"                  Why, that were covetousness.",PHEBE
1792,3.5.95,"Silvius, the time was that I hated thee,",PHEBE
1793,3.5.96,And yet it is not that I bear thee love;,PHEBE
1794,3.5.97,"But since that thou canst talk of love so well,",PHEBE
1795,3.5.98,"Thy company, which erst was irksome to me,",PHEBE
1796,3.5.99,"I will endure, and I'll employ thee too:",PHEBE
1797,3.5.100,But do not look for further recompense,PHEBE
1798,3.5.101,Than thine own gladness that thou art employ'd.,PHEBE
1799,3.5.102,"So holy and so perfect is my love,",SILVIUS
1800,3.5.103,"And I in such a poverty of grace,",SILVIUS
1801,3.5.104,That I shall think it a most plenteous crop,SILVIUS
1802,3.5.105,To glean the broken ears after the man,SILVIUS
1803,3.5.106,That the main harvest reaps: loose now and then,SILVIUS
1804,3.5.107,"A scatter'd smile, and that I'll live upon.",SILVIUS
1805,3.5.108,Know'st now the youth that spoke to me erewhile?,PHEBE
1806,3.5.109,"Not very well, but I have met him oft;",SILVIUS
1807,3.5.110,And he hath bought the cottage and the bounds,SILVIUS
1808,3.5.111,That the old carlot once was master of.,SILVIUS
1809,3.5.112,"Think not I love him, though I ask for him:",PHEBE
1810,3.5.113,'Tis but a peevish boy; yet he talks well;,PHEBE
1811,3.5.114,But what care I for words? yet words do well,PHEBE
1812,3.5.115,When he that speaks them pleases those that hear.,PHEBE
1813,3.5.116,It is a pretty youth: not very pretty:,PHEBE
1814,3.5.117,"But, sure, he's proud, and yet his pride becomes him:",PHEBE
1815,3.5.118,He'll make a proper man: the best thing in him,PHEBE
1816,3.5.119,Is his complexion; and faster than his tongue,PHEBE
1817,3.5.120,Did make offence his eye did heal it up.,PHEBE
1818,3.5.121,He is not very tall; yet for his years he's tall:,PHEBE
1819,3.5.122,His leg is but so so; and yet 'tis well:,PHEBE
1820,3.5.123,"There was a pretty redness in his lip,",PHEBE
1821,3.5.124,A little riper and more lusty red,PHEBE
1822,3.5.125,Than that mix'd in his cheek; 'twas just the difference,PHEBE
1823,3.5.126,Between the constant red and mingled damask.,PHEBE
1824,3.5.127,"There be some women, Silvius, had they mark'd him",PHEBE
1825,3.5.128,"In parcels as I did, would have gone near",PHEBE
1826,3.5.129,"To fall in love with him; but, for my part,",PHEBE
1827,3.5.130,I love him not nor hate him not; and yet,PHEBE
1828,3.5.131,I have more cause to hate him than to love him:,PHEBE
1829,3.5.132,For what had he to do to chide at me?,PHEBE
1830,3.5.133,He said mine eyes were black and my hair black:,PHEBE
1831,3.5.134,"And, now I am remember'd, scorn'd at me:",PHEBE
1832,3.5.135,I marvel why I answer'd not again:,PHEBE
1833,3.5.136,But that's all one; omittance is no quittance.,PHEBE
1834,3.5.137,"I'll write to him a very taunting letter,",PHEBE
1835,3.5.138,"And thou shalt bear it: wilt thou, Silvius?",PHEBE
1836,3.5.139,"Phebe, with all my heart.",SILVIUS
1837,3.5.140,I'll write it straight;,PHEBE
1838,3.5.141,The matter's in my head and in my heart:,PHEBE
1839,3.5.142,I will be bitter with him and passing short.,PHEBE
1840,3.5.143,"Go with me, Silvius.",PHEBE
1841,4.1.1,"I prithee, pretty youth, let me be better acquainted",JAQUES
1842,4.1.2,with thee.,JAQUES
1843,4.1.3,They say you are a melancholy fellow.,ROSALIND
1844,4.1.4,I am so; I do love it better than laughing.,JAQUES
1845,4.1.5,Those that are in extremity of either are abominable,ROSALIND
1846,4.1.6,fellows and betray themselves to every modern,ROSALIND
1847,4.1.7,censure worse than drunkards.,ROSALIND
1848,4.1.8,"Why, 'tis good to be sad and say nothing.",JAQUES
1849,4.1.9,"Why then, 'tis good to be a post.",ROSALIND
1850,4.1.10,"I have neither the scholar's melancholy, which is",JAQUES
1851,4.1.11,"emulation, nor the musician's, which is fantastical,",JAQUES
1852,4.1.12,"nor the courtier's, which is proud, nor the",JAQUES
1853,4.1.13,"soldier's, which is ambitious, nor the lawyer's,",JAQUES
1854,4.1.14,"which is politic, nor the lady's, which is nice, nor",JAQUES
1855,4.1.15,"the lover's, which is all these: but it is a",JAQUES
1856,4.1.16,"melancholy of mine own, compounded of many simples,",JAQUES
1857,4.1.17,"extracted from many objects, and indeed the sundry's",JAQUES
1858,4.1.18,"contemplation of my travels, in which my often",JAQUES
1859,4.1.19,rumination wraps me m a most humorous sadness.,JAQUES
1860,4.1.20,"A traveller! By my faith, you have great reason to",ROSALIND
1861,4.1.21,be sad: I fear you have sold your own lands to see,ROSALIND
1862,4.1.22,"other men's; then, to have seen much and to have",ROSALIND
1863,4.1.23,"nothing, is to have rich eyes and poor hands.",ROSALIND
1864,4.1.24,"Yes, I have gained my experience.",JAQUES
1865,4.1.25,And your experience makes you sad: I had rather have,ROSALIND
1866,4.1.26,a fool to make me merry than experience to make me,ROSALIND
1867,4.1.27,sad; and to travel for it too!,ROSALIND
1868,4.1.28,"Good day and happiness, dear Rosalind!",ORLANDO
1869,4.1.29,"Nay, then, God be wi' you, an you talk in blank verse.",JAQUES
1870,4.1.30,"Farewell, Monsieur Traveller: look you lisp and",ROSALIND
1871,4.1.31,"wear strange suits, disable all the benefits of your",ROSALIND
1872,4.1.32,"own country, be out of love with your nativity and",ROSALIND
1873,4.1.33,almost chide God for making you that countenance you,ROSALIND
1874,4.1.34,"are, or I will scarce think you have swam in a",ROSALIND
1875,4.1.35,"gondola. Why, how now, Orlando! where have you been",ROSALIND
1876,4.1.36,all this while? You a lover! An you serve me such,ROSALIND
1877,4.1.37,"another trick, never come in my sight more.",ROSALIND
1878,4.1.38,"My fair Rosalind, I come within an hour of my promise.",ORLANDO
1879,4.1.39,Break an hour's promise in love! He that will,ROSALIND
1880,4.1.40,divide a minute into a thousand parts and break but,ROSALIND
1881,4.1.41,a part of the thousandth part of a minute in the,ROSALIND
1882,4.1.42,"affairs of love, it may be said of him that Cupid",ROSALIND
1883,4.1.43,"hath clapped him o' the shoulder, but I'll warrant",ROSALIND
1884,4.1.44,him heart-whole.,ROSALIND
1885,4.1.45,"Pardon me, dear Rosalind.",ORLANDO
1886,4.1.46,"Nay, an you be so tardy, come no more in my sight: I",ROSALIND
1887,4.1.47,had as lief be wooed of a snail.,ROSALIND
1888,4.1.48,Of a snail?,ORLANDO
1889,4.1.49,"Ay, of a snail; for though he comes slowly, he",ROSALIND
1890,4.1.50,"carries his house on his head; a better jointure,",ROSALIND
1891,4.1.51,"I think, than you make a woman: besides he brings",ROSALIND
1892,4.1.52,his destiny with him.,ROSALIND
1893,4.1.53,What's that?,ORLANDO
1894,4.1.54,"Why, horns, which such as you are fain to be",ROSALIND
1895,4.1.55,beholding to your wives for: but he comes armed in,ROSALIND
1896,4.1.56,his fortune and prevents the slander of his wife.,ROSALIND
1897,4.1.57,Virtue is no horn-maker; and my Rosalind is virtuous.,ORLANDO
1898,4.1.58,And I am your Rosalind.,ROSALIND
1899,4.1.59,It pleases him to call you so; but he hath a,CELIA
1900,4.1.60,Rosalind of a better leer than you.,CELIA
1901,4.1.61,"Come, woo me, woo me, for now I am in a holiday",ROSALIND
1902,4.1.62,humour and like enough to consent. What would you,ROSALIND
1903,4.1.63,"say to me now, an I were your very very Rosalind?",ROSALIND
1904,4.1.64,I would kiss before I spoke.,ORLANDO
1905,4.1.65,"Nay, you were better speak first, and when you were",ROSALIND
1906,4.1.66,"gravelled for lack of matter, you might take",ROSALIND
1907,4.1.67,"occasion to kiss. Very good orators, when they are",ROSALIND
1908,4.1.68,"out, they will spit; and for lovers lacking--God",ROSALIND
1909,4.1.69,"warn us!--matter, the cleanliest shift is to kiss.",ROSALIND
1910,4.1.70,How if the kiss be denied?,ORLANDO
1911,4.1.71,"Then she puts you to entreaty, and there begins new matter.",ROSALIND
1912,4.1.72,"Who could be out, being before his beloved mistress?",ORLANDO
1913,4.1.73,"Marry, that should you, if I were your mistress, or",ROSALIND
1914,4.1.74,I should think my honesty ranker than my wit.,ROSALIND
1915,4.1.75,"What, of my suit?",ORLANDO
1916,4.1.76,"Not out of your apparel, and yet out of your suit.",ROSALIND
1917,4.1.77,Am not I your Rosalind?,ROSALIND
1918,4.1.78,"I take some joy to say you are, because I would be",ORLANDO
1919,4.1.79,talking of her.,ORLANDO
1920,4.1.80,Well in her person I say I will not have you.,ROSALIND
1921,4.1.81,Then in mine own person I die.,ORLANDO
1922,4.1.82,"No, faith, die by attorney. The poor world is",ROSALIND
1923,4.1.83,"almost six thousand years old, and in all this time",ROSALIND
1924,4.1.84,"there was not any man died in his own person,",ROSALIND
1925,4.1.85,"videlicit, in a love-cause. Troilus had his brains",ROSALIND
1926,4.1.86,dashed out with a Grecian club; yet he did what he,ROSALIND
1927,4.1.87,"could to die before, and he is one of the patterns",ROSALIND
1928,4.1.88,"of love. Leander, he would have lived many a fair",ROSALIND
1929,4.1.89,"year, though Hero had turned nun, if it had not been",ROSALIND
1930,4.1.90,"for a hot midsummer night; for, good youth, he went",ROSALIND
1931,4.1.91,but forth to wash him in the Hellespont and being,ROSALIND
1932,4.1.92,taken with the cramp was drowned and the foolish,ROSALIND
1933,4.1.93,coroners of that age found it was 'Hero of Sestos.',ROSALIND
1934,4.1.94,But these are all lies: men have died from time to,ROSALIND
1935,4.1.95,"time and worms have eaten them, but not for love.",ROSALIND
1936,4.1.96,"I would not have my right Rosalind of this mind,",ORLANDO
1937,4.1.97,"for, I protest, her frown might kill me.",ORLANDO
1938,4.1.98,"By this hand, it will not kill a fly. But come, now",ROSALIND
1939,4.1.99,I will be your Rosalind in a more coming-on,ROSALIND
1940,4.1.100,"disposition, and ask me what you will. I will grant",ROSALIND
1941,4.1.101,it.,ROSALIND
1942,4.1.102,"Then love me, Rosalind.",ORLANDO
1943,4.1.103,"Yes, faith, will I, Fridays and Saturdays and all.",ROSALIND
1944,4.1.104,And wilt thou have me?,ORLANDO
1945,4.1.105,"Ay, and twenty such.",ROSALIND
1946,4.1.106,What sayest thou?,ORLANDO
1947,4.1.107,Are you not good?,ROSALIND
1948,4.1.108,I hope so.,ORLANDO
1949,4.1.109,"Why then, can one desire too much of a good thing?",ROSALIND
1950,4.1.110,"Come, sister, you shall be the priest and marry us.",ROSALIND
1951,4.1.111,"Give me your hand, Orlando. What do you say, sister?",ROSALIND
1952,4.1.112,"Pray thee, marry us.",ORLANDO
1953,4.1.113,I cannot say the words.,CELIA
1954,4.1.114,"You must begin, 'Will you, Orlando--'",ROSALIND
1955,4.1.115,"Go to. Will you, Orlando, have to wife this Rosalind?",CELIA
1956,4.1.116,I will.,ORLANDO
1957,4.1.117,"Ay, but when?",ROSALIND
1958,4.1.118,Why now; as fast as she can marry us.,ORLANDO
1959,4.1.119,"Then you must say 'I take thee, Rosalind, for wife.'",ROSALIND
1960,4.1.120,"I take thee, Rosalind, for wife.",ORLANDO
1961,4.1.121,I might ask you for your commission; but I do take,ROSALIND
1962,4.1.122,"thee, Orlando, for my husband: there's a girl goes",ROSALIND
1963,4.1.123,before the priest; and certainly a woman's thought,ROSALIND
1964,4.1.124,runs before her actions.,ROSALIND
1965,4.1.125,So do all thoughts; they are winged.,ORLANDO
1966,4.1.126,Now tell me how long you would have her after you,ROSALIND
1967,4.1.127,have possessed her.,ROSALIND
1968,4.1.128,For ever and a day.,ORLANDO
1969,4.1.129,"Say 'a day,' without the 'ever.' No, no, Orlando;",ROSALIND
1970,4.1.130,"men are April when they woo, December when they wed:",ROSALIND
1971,4.1.131,"maids are May when they are maids, but the sky",ROSALIND
1972,4.1.132,changes when they are wives. I will be more jealous,ROSALIND
1973,4.1.133,"of thee than a Barbary cock-pigeon over his hen,",ROSALIND
1974,4.1.134,"more clamorous than a parrot against rain, more",ROSALIND
1975,4.1.135,"new-fangled than an ape, more giddy in my desires",ROSALIND
1976,4.1.136,"than a monkey: I will weep for nothing, like Diana",ROSALIND
1977,4.1.137,"in the fountain, and I will do that when you are",ROSALIND
1978,4.1.138,"disposed to be merry; I will laugh like a hyen, and",ROSALIND
1979,4.1.139,that when thou art inclined to sleep.,ROSALIND
1980,4.1.140,But will my Rosalind do so?,ORLANDO
1981,4.1.141,"By my life, she will do as I do.",ROSALIND
1982,4.1.142,"O, but she is wise.",ORLANDO
1983,4.1.143,Or else she could not have the wit to do this: the,ROSALIND
1984,4.1.144,"wiser, the waywarder: make the doors upon a woman's",ROSALIND
1985,4.1.145,wit and it will out at the casement; shut that and,ROSALIND
1986,4.1.146,"'twill out at the key-hole; stop that, 'twill fly",ROSALIND
1987,4.1.147,with the smoke out at the chimney.,ROSALIND
1988,4.1.148,"A man that had a wife with such a wit, he might say",ORLANDO
1989,4.1.149,"'Wit, whither wilt?'",ORLANDO
1990,4.1.150,"Nay, you might keep that cheque for it till you met",ROSALIND
1991,4.1.151,your wife's wit going to your neighbour's bed.,ROSALIND
1992,4.1.152,And what wit could wit have to excuse that?,ORLANDO
1993,4.1.153,"Marry, to say she came to seek you there. You shall",ROSALIND
1994,4.1.154,"never take her without her answer, unless you take",ROSALIND
1995,4.1.155,"her without her tongue. O, that woman that cannot",ROSALIND
1996,4.1.156,"make her fault her husband's occasion, let her",ROSALIND
1997,4.1.157,"never nurse her child herself, for she will breed",ROSALIND
1998,4.1.158,it like a fool!,ROSALIND
1999,4.1.159,"For these two hours, Rosalind, I will leave thee.",ORLANDO
2000,4.1.160,"Alas! dear love, I cannot lack thee two hours.",ROSALIND
2001,4.1.161,I must attend the duke at dinner: by two o'clock I,ORLANDO
2002,4.1.162,will be with thee again.,ORLANDO
2003,4.1.163,"Ay, go your ways, go your ways; I knew what you",ROSALIND
2004,4.1.164,"would prove: my friends told me as much, and I",ROSALIND
2005,4.1.165,thought no less: that flattering tongue of yours,ROSALIND
2006,4.1.166,"won me: 'tis but one cast away, and so, come,",ROSALIND
2007,4.1.167,death! Two o'clock is your hour?,ROSALIND
2008,4.1.168,"Ay, sweet Rosalind.",ORLANDO
2009,4.1.169,"By my troth, and in good earnest, and so God mend",ROSALIND
2010,4.1.170,"me, and by all pretty oaths that are not dangerous,",ROSALIND
2011,4.1.171,if you break one jot of your promise or come one,ROSALIND
2012,4.1.172,"minute behind your hour, I will think you the most",ROSALIND
2013,4.1.173,pathetical break-promise and the most hollow lover,ROSALIND
2014,4.1.174,and the most unworthy of her you call Rosalind that,ROSALIND
2015,4.1.175,may be chosen out of the gross band of the,ROSALIND
2016,4.1.176,unfaithful: therefore beware my censure and keep,ROSALIND
2017,4.1.177,your promise.,ROSALIND
2018,4.1.178,With no less religion than if thou wert indeed my,ORLANDO
2019,4.1.179,Rosalind: so adieu.,ORLANDO
2020,4.1.180,"Well, Time is the old justice that examines all such",ROSALIND
2021,4.1.181,"offenders, and let Time try: adieu.",ROSALIND
2022,4.1.182,You have simply misused our sex in your love-prate:,CELIA
2023,4.1.183,we must have your doublet and hose plucked over your,CELIA
2024,4.1.184,"head, and show the world what the bird hath done to",CELIA
2025,4.1.185,her own nest.,CELIA
2026,4.1.186,"O coz, coz, coz, my pretty little coz, that thou",ROSALIND
2027,4.1.187,didst know how many fathom deep I am in love! But,ROSALIND
2028,4.1.188,it cannot be sounded: my affection hath an unknown,ROSALIND
2029,4.1.189,"bottom, like the bay of Portugal.",ROSALIND
2030,4.1.190,"Or rather, bottomless, that as fast as you pour",CELIA
2031,4.1.191,"affection in, it runs out.",CELIA
2032,4.1.192,"No, that same wicked bastard of Venus that was begot",ROSALIND
2033,4.1.193,"of thought, conceived of spleen and born of madness,",ROSALIND
2034,4.1.194,that blind rascally boy that abuses every one's eyes,ROSALIND
2035,4.1.195,"because his own are out, let him be judge how deep I",ROSALIND
2036,4.1.196,"am in love. I'll tell thee, Aliena, I cannot be out",ROSALIND
2037,4.1.197,of the sight of Orlando: I'll go find a shadow and,ROSALIND
2038,4.1.198,sigh till he come.,ROSALIND
2039,4.1.199,And I'll sleep.,CELIA
2040,4.2.1,Which is he that killed the deer?,JAQUES
2041,4.2.2,"Sir, it was I.",A Lord
2042,4.2.3,"Let's present him to the duke, like a Roman",JAQUES
2043,4.2.4,conqueror; and it would do well to set the deer's,JAQUES
2044,4.2.5,"horns upon his head, for a branch of victory. Have",JAQUES
2045,4.2.6,"you no song, forester, for this purpose?",JAQUES
2046,4.2.7,"Yes, sir.",Forester
2047,4.2.8,"Sing it: 'tis no matter how it be in tune, so it",JAQUES
2048,4.2.9,make noise enough.,JAQUES
2049,4.2.10,SONG.,JAQUES
2050,4.2.11,What shall he have that kill'd the deer?,Forester
2051,4.2.12,His leather skin and horns to wear.,Forester
2052,4.2.13,Then sing him home;,Forester
2053,4.2.14,Take thou no scorn to wear the horn;,Forester
2054,4.2.15,It was a crest ere thou wast born:,Forester
2055,4.2.16,"Thy father's father wore it,",Forester
2056,4.2.17,And thy father bore it:,Forester
2057,4.2.18,"The horn, the horn, the lusty horn",Forester
2058,4.2.19,Is not a thing to laugh to scorn.,Forester
2059,4.3.1,How say you now? Is it not past two o'clock? and,ROSALIND
2060,4.3.2,here much Orlando!,ROSALIND
2061,4.3.3,"I warrant you, with pure love and troubled brain, he",CELIA
2062,4.3.4,hath ta'en his bow and arrows and is gone forth to,CELIA
2063,4.3.5,"sleep. Look, who comes here.",CELIA
2064,4.3.6,"My errand is to you, fair youth;",SILVIUS
2065,4.3.7,My gentle Phebe bid me give you this:,SILVIUS
2066,4.3.8,"I know not the contents; but, as I guess",SILVIUS
2067,4.3.9,By the stern brow and waspish action,SILVIUS
2068,4.3.10,"Which she did use as she was writing of it,",SILVIUS
2069,4.3.11,It bears an angry tenor: pardon me:,SILVIUS
2070,4.3.12,I am but as a guiltless messenger.,SILVIUS
2071,4.3.13,Patience herself would startle at this letter,ROSALIND
