,LineNos,Lines,Speakers
2568,4.2.370,"'Twas but a bolt of nothing, shot at nothing,",IMOGEN
2569,4.2.371,Which the brain makes of fumes: our very eyes,IMOGEN
2570,4.2.372,"Are sometimes like our judgments, blind. Good faith,",IMOGEN
2571,4.2.373,I tremble stiff with fear: but if there be,IMOGEN
2572,4.2.374,Yet left in heaven as small a drop of pity,IMOGEN
2573,4.2.375,"As a wren's eye, fear'd gods, a part of it!",IMOGEN
2574,4.2.376,"The dream's here still: even when I wake, it is",IMOGEN
2575,4.2.377,"Without me, as within me; not imagined, felt.",IMOGEN
2576,4.2.378,A headless man! The garments of Posthumus!,IMOGEN
2577,4.2.379,I know the shape of's leg: this is his hand;,IMOGEN
2578,4.2.380,His foot Mercurial; his Martial thigh;,IMOGEN
2579,4.2.381,The brawns of Hercules: but his Jovial face,IMOGEN
2580,4.2.382,"Murder in heaven?--How!--'Tis gone. Pisanio,",IMOGEN
2581,4.2.383,"All curses madded Hecuba gave the Greeks,",IMOGEN
2582,4.2.384,"And mine to boot, be darted on thee! Thou,",IMOGEN
2583,4.2.385,"Conspired with that irregulous devil, Cloten,",IMOGEN
2584,4.2.386,Hast here cut off my lord. To write and read,IMOGEN
2585,4.2.387,Be henceforth treacherous! Damn'd Pisanio,IMOGEN
2586,4.2.388,"Hath with his forged letters,--damn'd Pisanio--",IMOGEN
2587,4.2.389,From this most bravest vessel of the world,IMOGEN
2588,4.2.390,"Struck the main-top! O Posthumus! alas,",IMOGEN
2589,4.2.391,Where is thy head? where's that? Ay me!,IMOGEN
2590,4.2.392,where's that?,IMOGEN
2591,4.2.393,"Pisanio might have kill'd thee at the heart,",IMOGEN
2592,4.2.394,And left this head on. How should this be? Pisanio?,IMOGEN
2593,4.2.395,'Tis he and Cloten: malice and lucre in them,IMOGEN
2594,4.2.396,"Have laid this woe here. O, 'tis pregnant, pregnant!",IMOGEN
2595,4.2.397,"The drug he gave me, which he said was precious",IMOGEN
2596,4.2.398,"And cordial to me, have I not found it",IMOGEN
2597,4.2.399,Murderous to the senses? That confirms it home:,IMOGEN
2598,4.2.400,"This is Pisanio's deed, and Cloten's: O!",IMOGEN
2599,4.2.401,"Give colour to my pale cheek with thy blood,",IMOGEN
2600,4.2.402,That we the horrider may seem to those,IMOGEN
2601,4.2.403,"Which chance to find us: O, my lord, my lord!",IMOGEN
2602,4.2.404,"To them the legions garrison'd in Gailia,",Captain
2603,4.2.405,"After your will, have cross'd the sea, attending",Captain
2604,4.2.406,You here at Milford-Haven with your ships:,Captain
2605,4.2.407,They are in readiness.,Captain
2606,4.2.408,But what from Rome?,CAIUS LUCIUS
2607,4.2.409,The senate hath stirr'd up the confiners,Captain
2608,4.2.410,"And gentlemen of Italy, most willing spirits,",Captain
2609,4.2.411,That promise noble service: and they come,Captain
2610,4.2.412,"Under the conduct of bold Iachimo,",Captain
2611,4.2.413,Syenna's brother.,Captain
2612,4.2.414,                  When expect you them?,CAIUS LUCIUS
2613,4.2.415,With the next benefit o' the wind.,Captain
2614,4.2.416,This forwardness,CAIUS LUCIUS
2615,4.2.417,Makes our hopes fair. Command our present numbers,CAIUS LUCIUS
2616,4.2.418,"Be muster'd; bid the captains look to't. Now, sir,",CAIUS LUCIUS
2617,4.2.419,What have you dream'd of late of this war's purpose?,CAIUS LUCIUS
2618,4.2.420,Last night the very gods show'd me a vision--,Soothsayer
2619,4.2.421,I fast and pray'd for their intelligence--thus:,Soothsayer
2620,4.2.422,"I saw Jove's bird, the Roman eagle, wing'd",Soothsayer
2621,4.2.423,"From the spongy south to this part of the west,",Soothsayer
2622,4.2.424,There vanish'd in the sunbeams: which portends--,Soothsayer
2623,4.2.425,Unless my sins abuse my divination--,Soothsayer
2624,4.2.426,Success to the Roman host.,Soothsayer
2625,4.2.427,"Dream often so,",CAIUS LUCIUS
2626,4.2.428,"And never false. Soft, ho! what trunk is here",CAIUS LUCIUS
2627,4.2.429,Without his top? The ruin speaks that sometime,CAIUS LUCIUS
2628,4.2.430,It was a worthy building. How! a page!,CAIUS LUCIUS
2629,4.2.431,"Or dead, or sleeping on him? But dead rather;",CAIUS LUCIUS
2630,4.2.432,For nature doth abhor to make his bed,CAIUS LUCIUS
2631,4.2.433,"With the defunct, or sleep upon the dead.",CAIUS LUCIUS
2632,4.2.434,Let's see the boy's face.,CAIUS LUCIUS
2633,4.2.435,"He's alive, my lord.",Captain
2634,4.2.436,"He'll then instruct us of this body. Young one,",CAIUS LUCIUS
2635,4.2.437,"Inform us of thy fortunes, for it seems",CAIUS LUCIUS
2636,4.2.438,They crave to be demanded. Who is this,CAIUS LUCIUS
2637,4.2.439,Thou makest thy bloody pillow? Or who was he,CAIUS LUCIUS
2638,4.2.440,"That, otherwise than noble nature did,",CAIUS LUCIUS
2639,4.2.441,Hath alter'd that good picture? What's thy interest,CAIUS LUCIUS
2640,4.2.442,In this sad wreck? How came it? Who is it?,CAIUS LUCIUS
2641,4.2.443,What art thou?,CAIUS LUCIUS
2642,4.2.444,"                  I am nothing: or if not,",IMOGEN
2643,4.2.445,"Nothing to be were better. This was my master,",IMOGEN
2644,4.2.446,"A very valiant Briton and a good,",IMOGEN
2645,4.2.447,That here by mountaineers lies slain. Alas!,IMOGEN
2646,4.2.448,There is no more such masters: I may wander,IMOGEN
2647,4.2.449,"From east to occident, cry out for service,",IMOGEN
2648,4.2.450,"Try many, all good, serve truly, never",IMOGEN
2649,4.2.451,Find such another master.,IMOGEN
2650,4.2.452,"'Lack, good youth!",CAIUS LUCIUS
2651,4.2.453,Thou movest no less with thy complaining than,CAIUS LUCIUS
2652,4.2.454,"Thy master in bleeding: say his name, good friend.",CAIUS LUCIUS
2653,4.2.455,Richard du Champ.,IMOGEN
2654,4.2.456,If I do lie and do,IMOGEN
2655,4.2.457,"No harm by it, though the gods hear, I hope",IMOGEN
2656,4.2.458,"They'll pardon it.--Say you, sir?",IMOGEN
2657,4.2.459,Thy name?,CAIUS LUCIUS
2658,4.2.460,"Fidele, sir.",IMOGEN
2659,4.2.461,Thou dost approve thyself the very same:,CAIUS LUCIUS
2660,4.2.462,"Thy name well fits thy faith, thy faith thy name.",CAIUS LUCIUS
2661,4.2.463,Wilt take thy chance with me? I will not say,CAIUS LUCIUS
2662,4.2.464,"Thou shalt be so well master'd, but, be sure,",CAIUS LUCIUS
2663,4.2.465,"No less beloved. The Roman emperor's letters,",CAIUS LUCIUS
2664,4.2.466,"Sent by a consul to me, should not sooner",CAIUS LUCIUS
2665,4.2.467,Than thine own worth prefer thee: go with me.,CAIUS LUCIUS
2666,4.2.468,"I'll follow, sir. But first, an't please the gods,",IMOGEN
2667,4.2.469,"I'll hide my master from the flies, as deep",IMOGEN
2668,4.2.470,As these poor pickaxes can dig; and when,IMOGEN
2669,4.2.471,"With wild wood-leaves and weeds I ha' strew'd his grave,",IMOGEN
2670,4.2.472,"And on it said a century of prayers,",IMOGEN
2671,4.2.473,"Such as I can, twice o'er, I'll weep and sigh;",IMOGEN
2672,4.2.474,"And leaving so his service, follow you,",IMOGEN
2673,4.2.475,So please you entertain me.,IMOGEN
2674,4.2.476,"Ay, good youth!",CAIUS LUCIUS
2675,4.2.477,And rather father thee than master thee.,CAIUS LUCIUS
2676,4.2.478,"My friends,",CAIUS LUCIUS
2677,4.2.479,The boy hath taught us manly duties: let us,CAIUS LUCIUS
2678,4.2.480,"Find out the prettiest daisied plot we can,",CAIUS LUCIUS
2679,4.2.481,And make him with our pikes and partisans,CAIUS LUCIUS
2680,4.2.482,"A grave: come, arm him. Boy, he is preferr'd",CAIUS LUCIUS
2681,4.2.483,"By thee to us, and he shall be interr'd",CAIUS LUCIUS
2682,4.2.484,As soldiers can. Be cheerful; wipe thine eyes,CAIUS LUCIUS
2683,4.2.485,Some falls are means the happier to arise.,CAIUS LUCIUS
2684,4.3.1,Again; and bring me word how 'tis with her.,CYMBELINE
2685,4.3.2,"A fever with the absence of her son,",CYMBELINE
2686,4.3.3,"A madness, of which her life's in danger. Heavens,",CYMBELINE
2687,4.3.4,"How deeply you at once do touch me! Imogen,",CYMBELINE
2688,4.3.5,"The great part of my comfort, gone; my queen",CYMBELINE
2689,4.3.6,"Upon a desperate bed, and in a time",CYMBELINE
2690,4.3.7,"When fearful wars point at me; her son gone,",CYMBELINE
2691,4.3.8,"So needful for this present: it strikes me, past",CYMBELINE
2692,4.3.9,"The hope of comfort. But for thee, fellow,",CYMBELINE
2693,4.3.10,Who needs must know of her departure and,CYMBELINE
2694,4.3.11,"Dost seem so ignorant, we'll enforce it from thee",CYMBELINE
2695,4.3.12,By a sharp torture.,CYMBELINE
2696,4.3.13,"Sir, my life is yours;",PISANIO
2697,4.3.14,"I humbly set it at your will; but, for my mistress,",PISANIO
2698,4.3.15,"I nothing know where she remains, why gone,",PISANIO
2699,4.3.16,"Nor when she purposes return. Beseech your highness,",PISANIO
2700,4.3.17,Hold me your loyal servant.,PISANIO
2701,4.3.18,"Good my liege,",First Lord
2702,4.3.19,The day that she was missing he was here:,First Lord
2703,4.3.20,I dare be bound he's true and shall perform,First Lord
2704,4.3.21,"All parts of his subjection loyally. For Cloten,",First Lord
2705,4.3.22,"There wants no diligence in seeking him,",First Lord
2706,4.3.23,"And will, no doubt, be found.",First Lord
2707,4.3.24,The time is troublesome.,CYMBELINE
2708,4.3.25,We'll slip you for a season; but our jealousy,CYMBELINE
2709,4.3.26,Does yet depend.,CYMBELINE
2710,4.3.27,"                  So please your majesty,",First Lord
2711,4.3.28,"The Roman legions, all from Gallia drawn,",First Lord
2712,4.3.29,"Are landed on your coast, with a supply",First Lord
2713,4.3.30,"Of Roman gentlemen, by the senate sent.",First Lord
2714,4.3.31,Now for the counsel of my son and queen!,CYMBELINE
2715,4.3.32,I am amazed with matter.,CYMBELINE
2716,4.3.33,"Good my liege,",First Lord
2717,4.3.34,Your preparation can affront no less,First Lord
2718,4.3.35,"Than what you hear of: come more, for more",First Lord
2719,4.3.36,you're ready:,First Lord
2720,4.3.37,The want is but to put those powers in motion,First Lord
2721,4.3.38,That long to move.,First Lord
2722,4.3.39,                  I thank you. Let's withdraw;,CYMBELINE
2723,4.3.40,And meet the time as it seeks us. We fear not,CYMBELINE
2724,4.3.41,What can from Italy annoy us; but,CYMBELINE
2725,4.3.42,We grieve at chances here. Away!,CYMBELINE
2726,4.3.43,I heard no letter from my master since,PISANIO
2727,4.3.44,I wrote him Imogen was slain: 'tis strange:,PISANIO
2728,4.3.45,Nor hear I from my mistress who did promise,PISANIO
2729,4.3.46,To yield me often tidings: neither know I,PISANIO
2730,4.3.47,What is betid to Cloten; but remain,PISANIO
2731,4.3.48,Perplex'd in all. The heavens still must work.,PISANIO
2732,4.3.49,"Wherein I am false I am honest; not true, to be true.",PISANIO
2733,4.3.50,"These present wars shall find I love my country,",PISANIO
2734,4.3.51,"Even to the note o' the king, or I'll fall in them.",PISANIO
2735,4.3.52,"All other doubts, by time let them be clear'd:",PISANIO
2736,4.3.53,Fortune brings in some boats that are not steer'd.,PISANIO
2737,4.4.1,The noise is round about us.,GUIDERIUS
2738,4.4.2,Let us from it.,BELARIUS
2739,4.4.3,"What pleasure, sir, find we in life, to lock it",ARVIRAGUS
2740,4.4.4,From action and adventure?,ARVIRAGUS
2741,4.4.5,"Nay, what hope",GUIDERIUS
2742,4.4.6,"Have we in hiding us? This way, the Romans",GUIDERIUS
2743,4.4.7,"Must or for Britons slay us, or receive us",GUIDERIUS
2744,4.4.8,For barbarous and unnatural revolts,GUIDERIUS
2745,4.4.9,"During their use, and slay us after.",GUIDERIUS
2746,4.4.10,"Sons,",BELARIUS
2747,4.4.11,We'll higher to the mountains; there secure us.,BELARIUS
2748,4.4.12,To the king's party there's no going: newness,BELARIUS
2749,4.4.13,"Of Cloten's death--we being not known, not muster'd",BELARIUS
2750,4.4.14,Among the bands--may drive us to a render,BELARIUS
2751,4.4.15,"Where we have lived, and so extort from's that",BELARIUS
2752,4.4.16,"Which we have done, whose answer would be death",BELARIUS
2753,4.4.17,Drawn on with torture.,BELARIUS
2754,4.4.18,"This is, sir, a doubt",GUIDERIUS
2755,4.4.19,"In such a time nothing becoming you,",GUIDERIUS
2756,4.4.20,Nor satisfying us.,GUIDERIUS
2757,4.4.21,                  It is not likely,ARVIRAGUS
2758,4.4.22,"That when they hear the Roman horses neigh,",ARVIRAGUS
2759,4.4.23,"Behold their quarter'd fires, have both their eyes",ARVIRAGUS
2760,4.4.24,"And ears so cloy'd importantly as now,",ARVIRAGUS
2761,4.4.25,"That they will waste their time upon our note,",ARVIRAGUS
2762,4.4.26,To know from whence we are.,ARVIRAGUS
2763,4.4.27,"O, I am known",BELARIUS
2764,4.4.28,"Of many in the army: many years,",BELARIUS
2765,4.4.29,"Though Cloten then but young, you see, not wore him",BELARIUS
2766,4.4.30,"From my remembrance. And, besides, the king",BELARIUS
2767,4.4.31,Hath not deserved my service nor your loves;,BELARIUS
2768,4.4.32,"Who find in my exile the want of breeding,",BELARIUS
2769,4.4.33,The certainty of this hard life; aye hopeless,BELARIUS
2770,4.4.34,"To have the courtesy your cradle promised,",BELARIUS
2771,4.4.35,But to be still hot summer's tamings and,BELARIUS
2772,4.4.36,The shrinking slaves of winter.,BELARIUS
2773,4.4.37,Than be so,GUIDERIUS
2774,4.4.38,"Better to cease to be. Pray, sir, to the army:",GUIDERIUS
2775,4.4.39,I and my brother are not known; yourself,GUIDERIUS
2776,4.4.40,"So out of thought, and thereto so o'ergrown,",GUIDERIUS
2777,4.4.41,Cannot be question'd.,GUIDERIUS
2778,4.4.42,"By this sun that shines,",ARVIRAGUS
2779,4.4.43,I'll thither: what thing is it that I never,ARVIRAGUS
2780,4.4.44,"Did see man die! scarce ever look'd on blood,",ARVIRAGUS
2781,4.4.45,"But that of coward hares, hot goats, and venison!",ARVIRAGUS
2782,4.4.46,"Never bestrid a horse, save one that had",ARVIRAGUS
2783,4.4.47,"A rider like myself, who ne'er wore rowel",ARVIRAGUS
2784,4.4.48,Nor iron on his heel! I am ashamed,ARVIRAGUS
2785,4.4.49,"To look upon the holy sun, to have",ARVIRAGUS
2786,4.4.50,"The benefit of his blest beams, remaining",ARVIRAGUS
2787,4.4.51,So long a poor unknown.,ARVIRAGUS
2788,4.4.52,"By heavens, I'll go:",GUIDERIUS
2789,4.4.53,"If you will bless me, sir, and give me leave,",GUIDERIUS
2790,4.4.54,"I'll take the better care, but if you will not,",GUIDERIUS
2791,4.4.55,The hazard therefore due fall on me by,GUIDERIUS
2792,4.4.56,The hands of Romans!,GUIDERIUS
2793,4.4.57,So say I	amen.,ARVIRAGUS
2794,4.4.58,"No reason I, since of your lives you set",BELARIUS
2795,4.4.59,"So slight a valuation, should reserve",BELARIUS
2796,4.4.60,"My crack'd one to more care. Have with you, boys!",BELARIUS
2797,4.4.61,"If in your country wars you chance to die,",BELARIUS
2798,4.4.62,"That is my bed too, lads, an there I'll lie:",BELARIUS
2799,4.4.63,"Lead, lead.",BELARIUS
2800,4.4.64,The time seems long; their blood,BELARIUS
2801,4.4.65,"thinks scorn,",BELARIUS
2802,4.4.66,Till it fly out and show them princes born.,BELARIUS
2803,5.1.1,"Yea, bloody cloth, I'll keep thee, for I wish'd",POSTHUMUS LEONATUS
2804,5.1.2,"Thou shouldst be colour'd thus. You married ones,",POSTHUMUS LEONATUS
2805,5.1.3,"If each of you should take this course, how many",POSTHUMUS LEONATUS
2806,5.1.4,Must murder wives much better than themselves,POSTHUMUS LEONATUS
2807,5.1.5,For wrying but a little! O Pisanio!,POSTHUMUS LEONATUS
2808,5.1.6,Every good servant does not all commands:,POSTHUMUS LEONATUS
2809,5.1.7,No bond but to do just ones. Gods! if you,POSTHUMUS LEONATUS
2810,5.1.8,"Should have ta'en vengeance on my faults, I never",POSTHUMUS LEONATUS
2811,5.1.9,Had lived to put on this: so had you saved,POSTHUMUS LEONATUS
2812,5.1.10,"The noble Imogen to repent, and struck",POSTHUMUS LEONATUS
2813,5.1.11,"Me, wretch more worth your vengeance. But, alack,",POSTHUMUS LEONATUS
2814,5.1.12,"You snatch some hence for little faults; that's love,",POSTHUMUS LEONATUS
2815,5.1.13,To have them fall no more: you some permit,POSTHUMUS LEONATUS
2816,5.1.14,"To second ills with ills, each elder worse,",POSTHUMUS LEONATUS
2817,5.1.15,"And make them dread it, to the doers' thrift.",POSTHUMUS LEONATUS
2818,5.1.16,"But Imogen is your own: do your best wills,",POSTHUMUS LEONATUS
2819,5.1.17,And make me blest to obey! I am brought hither,POSTHUMUS LEONATUS
2820,5.1.18,"Among the Italian gentry, and to fight",POSTHUMUS LEONATUS
2821,5.1.19,Against my lady's kingdom: 'tis enough,POSTHUMUS LEONATUS
2822,5.1.20,"That, Britain, I have kill'd thy mistress; peace!",POSTHUMUS LEONATUS
2823,5.1.21,"I'll give no wound to thee. Therefore, good heavens,",POSTHUMUS LEONATUS
2824,5.1.22,Hear patiently my purpose: I'll disrobe me,POSTHUMUS LEONATUS
2825,5.1.23,Of these Italian weeds and suit myself,POSTHUMUS LEONATUS
2826,5.1.24,As does a Briton peasant: so I'll fight,POSTHUMUS LEONATUS
2827,5.1.25,Against the part I come with; so I'll die,POSTHUMUS LEONATUS
2828,5.1.26,"For thee, O Imogen, even for whom my life",POSTHUMUS LEONATUS
2829,5.1.27,"Is every breath a death; and thus, unknown,",POSTHUMUS LEONATUS
2830,5.1.28,"Pitied nor hated, to the face of peril",POSTHUMUS LEONATUS
2831,5.1.29,Myself I'll dedicate. Let me make men know,POSTHUMUS LEONATUS
2832,5.1.30,More valour in me than my habits show.,POSTHUMUS LEONATUS
2833,5.1.31,"Gods, put the strength o' the Leonati in me!",POSTHUMUS LEONATUS
2834,5.1.32,"To shame the guise o' the world, I will begin",POSTHUMUS LEONATUS
2835,5.1.33,"The fashion, less without and more within.",POSTHUMUS LEONATUS
2836,5.2.1,The heaviness and guilt within my bosom,IACHIMO
2837,5.2.2,"Takes off my manhood: I have belied a lady,",IACHIMO
2838,5.2.3,"The princess of this country, and the air on't",IACHIMO
2839,5.2.4,"Revengingly enfeebles me; or could this carl,",IACHIMO
2840,5.2.5,"A very drudge of nature's, have subdued me",IACHIMO
2841,5.2.6,"In my profession? Knighthoods and honours, borne",IACHIMO
2842,5.2.7,"As I wear mine, are titles but of scorn.",IACHIMO
2843,5.2.8,"If that thy gentry, Britain, go before",IACHIMO
2844,5.2.9,"This lout as he exceeds our lords, the odds",IACHIMO
2845,5.2.10,Is that we scarce are men and you are gods.,IACHIMO
2846,5.2.11,"Stand, stand! We have the advantage of the ground;",BELARIUS
2847,5.2.12,The lane is guarded: nothing routs us but,BELARIUS
2848,5.2.13,The villany of our fears.,BELARIUS
2849,5.2.14,"Stand, stand, and fight!",ARVIRAGUS
2850,5.2.15,"Away, boy, from the troops, and save thyself;",CAIUS LUCIUS
2851,5.2.16,"For friends kill friends, and the disorder's such",CAIUS LUCIUS
2852,5.2.17,As war were hoodwink'd.,CAIUS LUCIUS
2853,5.2.18,'Tis their fresh supplies.,IACHIMO
2854,5.2.19,It is a day turn'd strangely: or betimes,CAIUS LUCIUS
2855,5.2.20,"Let's reinforce, or fly.",CAIUS LUCIUS
2856,5.3.1,Camest thou from where they made the stand?,Lord
2857,5.3.2,I did.,POSTHUMUS LEONATUS
2858,5.3.3,"Though you, it seems, come from the fliers.",POSTHUMUS LEONATUS
2859,5.3.4,I did.,Lord
2860,5.3.5,"No blame be to you, sir; for all was lost,",POSTHUMUS LEONATUS
2861,5.3.6,But that the heavens fought: the king himself,POSTHUMUS LEONATUS
2862,5.3.7,"Of his wings destitute, the army broken,",POSTHUMUS LEONATUS
2863,5.3.8,"And but the backs of Britons seen, all flying",POSTHUMUS LEONATUS
2864,5.3.9,"Through a straight lane; the enemy full-hearted,",POSTHUMUS LEONATUS
2865,5.3.10,"Lolling the tongue with slaughtering, having work",POSTHUMUS LEONATUS
2866,5.3.11,"More plentiful than tools to do't, struck down",POSTHUMUS LEONATUS
2867,5.3.12,"Some mortally, some slightly touch'd, some falling",POSTHUMUS LEONATUS
2868,5.3.13,Merely through fear; that the straight pass was damm'd,POSTHUMUS LEONATUS
2869,5.3.14,"With dead men hurt behind, and cowards living",POSTHUMUS LEONATUS
2870,5.3.15,To die with lengthen'd shame.,POSTHUMUS LEONATUS
2871,5.3.16,Where was this lane?,Lord
2872,5.3.17,"Close by the battle, ditch'd, and wall'd with turf;",POSTHUMUS LEONATUS
2873,5.3.18,"Which gave advantage to an ancient soldier,",POSTHUMUS LEONATUS
2874,5.3.19,"An honest one, I warrant; who deserved",POSTHUMUS LEONATUS
2875,5.3.20,"So long a breeding as his white beard came to,",POSTHUMUS LEONATUS
2876,5.3.21,"In doing this for's country: athwart the lane,",POSTHUMUS LEONATUS
2877,5.3.22,"He, with two striplings-lads more like to run",POSTHUMUS LEONATUS
2878,5.3.23,The country base than to commit such slaughter,POSTHUMUS LEONATUS
2879,5.3.24,"With faces fit for masks, or rather fairer",POSTHUMUS LEONATUS
2880,5.3.25,"Than those for preservation cased, or shame--",POSTHUMUS LEONATUS
2881,5.3.26,"Made good the passage; cried to those that fled,",POSTHUMUS LEONATUS
2882,5.3.27,"'Our Britain s harts die flying, not our men:",POSTHUMUS LEONATUS
2883,5.3.28,To darkness fleet souls that fly backwards. Stand;,POSTHUMUS LEONATUS
2884,5.3.29,Or we are Romans and will give you that,POSTHUMUS LEONATUS
2885,5.3.30,"Like beasts which you shun beastly, and may save,",POSTHUMUS LEONATUS
2886,5.3.31,"But to look back in frown: stand, stand.'",POSTHUMUS LEONATUS
2887,5.3.32,"These three,",POSTHUMUS LEONATUS
2888,5.3.33,"Three thousand confident, in act as many--",POSTHUMUS LEONATUS
2889,5.3.34,For three performers are the file when all,POSTHUMUS LEONATUS
2890,5.3.35,"The rest do nothing--with this word 'Stand, stand,'",POSTHUMUS LEONATUS
2891,5.3.36,"Accommodated by the place, more charming",POSTHUMUS LEONATUS
2892,5.3.37,"With their own nobleness, which could have turn'd",POSTHUMUS LEONATUS
2893,5.3.38,"A distaff to a lance, gilded pale looks,",POSTHUMUS LEONATUS
2894,5.3.39,"Part shame, part spirit renew'd; that some,",POSTHUMUS LEONATUS
2895,5.3.40,turn'd coward,POSTHUMUS LEONATUS
2896,5.3.41,"But by example--O, a sin in war,",POSTHUMUS LEONATUS
2897,5.3.42,Damn'd in the first beginners!--gan to look,POSTHUMUS LEONATUS
2898,5.3.43,"The way that they did, and to grin like lions",POSTHUMUS LEONATUS
2899,5.3.44,Upon the pikes o' the hunters. Then began,POSTHUMUS LEONATUS
2900,5.3.45,"A stop i' the chaser, a retire, anon",POSTHUMUS LEONATUS
2901,5.3.46,"A rout, confusion thick; forthwith they fly",POSTHUMUS LEONATUS
2902,5.3.47,"Chickens, the way which they stoop'd eagles; slaves,",POSTHUMUS LEONATUS
2903,5.3.48,"The strides they victors made: and now our cowards,",POSTHUMUS LEONATUS
2904,5.3.49,"Like fragments in hard voyages, became",POSTHUMUS LEONATUS
2905,5.3.50,The life o' the need: having found the backdoor open,POSTHUMUS LEONATUS
2906,5.3.51,"Of the unguarded hearts, heavens, how they wound!",POSTHUMUS LEONATUS
2907,5.3.52,Some slain before; some dying; some their friends,POSTHUMUS LEONATUS
2908,5.3.53,"O'er borne i' the former wave: ten, chased by one,",POSTHUMUS LEONATUS
2909,5.3.54,Are now each one the slaughter-man of twenty:,POSTHUMUS LEONATUS
2910,5.3.55,Those that would die or ere resist are grown,POSTHUMUS LEONATUS
2911,5.3.56,The mortal bugs o' the field.,POSTHUMUS LEONATUS
2912,5.3.57,This was strange chance,Lord
2913,5.3.58,"A narrow lane, an old man, and two boys.",Lord
2914,5.3.59,"Nay, do not wonder at it: you are made",POSTHUMUS LEONATUS
2915,5.3.60,Rather to wonder at the things you hear,POSTHUMUS LEONATUS
2916,5.3.61,"Than to work any. Will you rhyme upon't,",POSTHUMUS LEONATUS
2917,5.3.62,And vent it for a mockery? Here is one:,POSTHUMUS LEONATUS
2918,5.3.63,"'Two boys, an old man twice a boy, a lane,",POSTHUMUS LEONATUS
2919,5.3.64,"Preserved the Britons, was the Romans' bane.'",POSTHUMUS LEONATUS
2920,5.3.65,"Nay, be not angry, sir.",Lord
2921,5.3.66,"'Lack, to what end?",POSTHUMUS LEONATUS
2922,5.3.67,"Who dares not stand his foe, I'll be his friend;",POSTHUMUS LEONATUS
2923,5.3.68,"For if he'll do as he is made to do,",POSTHUMUS LEONATUS
2924,5.3.69,I know he'll quickly fly my friendship too.,POSTHUMUS LEONATUS
2925,5.3.70,You have put me into rhyme.,POSTHUMUS LEONATUS
2926,5.3.71,Farewell; you're angry.,Lord
2927,5.3.72,Still going?,POSTHUMUS LEONATUS
2928,5.3.73,"This is a lord! O noble misery,",POSTHUMUS LEONATUS
2929,5.3.74,"To be i' the field, and ask 'what news?' of me!",POSTHUMUS LEONATUS
2930,5.3.75,To-day how many would have given their honours,POSTHUMUS LEONATUS
2931,5.3.76,"To have saved their carcasses! took heel to do't,",POSTHUMUS LEONATUS
2932,5.3.77,"And yet died too! I, in mine own woe charm'd,",POSTHUMUS LEONATUS
2933,5.3.78,"Could not find death where I did hear him groan,",POSTHUMUS LEONATUS
2934,5.3.79,"Nor feel him where he struck: being an ugly monster,",POSTHUMUS LEONATUS
2935,5.3.80,"'Tis strange he hides him in fresh cups, soft beds,",POSTHUMUS LEONATUS
2936,5.3.81,Sweet words; or hath more ministers than we,POSTHUMUS LEONATUS
2937,5.3.82,"That draw his knives i' the war. Well, I will find him",POSTHUMUS LEONATUS
2938,5.3.83,"For being now a favourer to the Briton,",POSTHUMUS LEONATUS
2939,5.3.84,"No more a Briton, I have resumed again",POSTHUMUS LEONATUS
2940,5.3.85,"The part I came in: fight I will no more,",POSTHUMUS LEONATUS
2941,5.3.86,But yield me to the veriest hind that shall,POSTHUMUS LEONATUS
2942,5.3.87,Once touch my shoulder. Great the slaughter is,POSTHUMUS LEONATUS
2943,5.3.88,Here made by the Roman; great the answer be,POSTHUMUS LEONATUS
2944,5.3.89,"Britons must take. For me, my ransom's death;",POSTHUMUS LEONATUS
2945,5.3.90,On either side I come to spend my breath;,POSTHUMUS LEONATUS
2946,5.3.91,"Which neither here I'll keep nor bear again,",POSTHUMUS LEONATUS
2947,5.3.92,But end it by some means for Imogen.,POSTHUMUS LEONATUS
2948,5.3.93,Great Jupiter be praised! Lucius is taken.,First Captain
2949,5.3.94,'Tis thought the old man and his sons were angels.,First Captain
2950,5.3.95,"There was a fourth man, in a silly habit,",Second Captain
2951,5.3.96,That gave the affront with them.,Second Captain
2952,5.3.97,So 'tis reported:,First Captain
2953,5.3.98,But none of 'em can be found. Stand! who's there?,First Captain
2954,5.3.99,"A Roman,",POSTHUMUS LEONATUS
2955,5.3.100,"Who had not now been drooping here, if seconds",POSTHUMUS LEONATUS
2956,5.3.101,Had answer'd him.,POSTHUMUS LEONATUS
2957,5.3.102,                  Lay hands on him; a dog!,Second Captain
2958,5.3.103,A leg of Rome shall not return to tell,Second Captain
2959,5.3.104,What crows have peck'd them here. He brags,Second Captain
2960,5.3.105,his service,Second Captain
2961,5.3.106,As if he were of note: bring him to the king.,Second Captain
2962,5.4.1,"You shall not now be stol'n, you have locks upon you;",First Gaoler
