,LineNos,Lines,Speakers
2326,4.3.124,"I had a thousand sons, the first humane principle I",FALSTAFF
2327,4.3.125,"would teach them should be, to forswear thin",FALSTAFF
2328,4.3.126,potations and to addict themselves to sack.,FALSTAFF
2329,4.3.127,How now Bardolph?,FALSTAFF
2330,4.3.128,The army is discharged all and gone.,BARDOLPH
2331,4.3.129,Let them go. I'll through Gloucestershire; and,FALSTAFF
2332,4.3.130,"there will I visit Master Robert Shallow, esquire:",FALSTAFF
2333,4.3.131,I have him already tempering between my finger and,FALSTAFF
2334,4.3.132,"my thumb, and shortly will I seal with him. Come away.",FALSTAFF
2335,4.4.1,"Now, lords, if God doth give successful end",KING HENRY IV
2336,4.4.2,"To this debate that bleedeth at our doors,",KING HENRY IV
2337,4.4.3,We will our youth lead on to higher fields,KING HENRY IV
2338,4.4.4,And draw no swords but what are sanctified.,KING HENRY IV
2339,4.4.5,"Our navy is address'd, our power collected,",KING HENRY IV
2340,4.4.6,"Our substitutes in absence well invested,",KING HENRY IV
2341,4.4.7,And every thing lies level to our wish:,KING HENRY IV
2342,4.4.8,"Only, we want a little personal strength;",KING HENRY IV
2343,4.4.9,"And pause us, till these rebels, now afoot,",KING HENRY IV
2344,4.4.10,Come underneath the yoke of government.,KING HENRY IV
2345,4.4.11,Both which we doubt not but your majesty,WARWICK
2346,4.4.12,Shall soon enjoy.,WARWICK
2347,4.4.13,"                  Humphrey, my son of Gloucester,",KING HENRY IV
2348,4.4.14,Where is the prince your brother?,KING HENRY IV
2349,4.4.15,"I think he's gone to hunt, my lord, at Windsor.",GLOUCESTER
2350,4.4.16,And how accompanied?,KING HENRY IV
2351,4.4.17,"I do not know, my lord.",GLOUCESTER
2352,4.4.18,"Is not his brother, Thomas of Clarence, with him?",KING HENRY IV
2353,4.4.19,"No, my good lord; he is in presence here.",GLOUCESTER
2354,4.4.20,What would my lord and father?,CLARENCE
2355,4.4.21,"Nothing but well to thee, Thomas of Clarence.",KING HENRY IV
2356,4.4.22,How chance thou art not with the prince thy brother?,KING HENRY IV
2357,4.4.23,"He loves thee, and thou dost neglect him, Thomas;",KING HENRY IV
2358,4.4.24,Thou hast a better place in his affection,KING HENRY IV
2359,4.4.25,"Than all thy brothers: cherish it, my boy,",KING HENRY IV
2360,4.4.26,And noble offices thou mayst effect,KING HENRY IV
2361,4.4.27,"Of mediation, after I am dead,",KING HENRY IV
2362,4.4.28,Between his greatness and thy other brethren:,KING HENRY IV
2363,4.4.29,"Therefore omit him not; blunt not his love,",KING HENRY IV
2364,4.4.30,Nor lose the good advantage of his grace,KING HENRY IV
2365,4.4.31,By seeming cold or careless of his will;,KING HENRY IV
2366,4.4.32,"For he is gracious, if he be observed:",KING HENRY IV
2367,4.4.33,He hath a tear for pity and a hand,KING HENRY IV
2368,4.4.34,Open as day for melting charity:,KING HENRY IV
2369,4.4.35,"Yet notwithstanding, being incensed, he's flint,",KING HENRY IV
2370,4.4.36,As humorous as winter and as sudden,KING HENRY IV
2371,4.4.37,As flaws congealed in the spring of day.,KING HENRY IV
2372,4.4.38,"His temper, therefore, must be well observed:",KING HENRY IV
2373,4.4.39,"Chide him for faults, and do it reverently,",KING HENRY IV
2374,4.4.40,When thou perceive his blood inclined to mirth;,KING HENRY IV
2375,4.4.41,"But, being moody, give him line and scope,",KING HENRY IV
2376,4.4.42,"Till that his passions, like a whale on ground,",KING HENRY IV
2377,4.4.43,"Confound themselves with working. Learn this, Thomas,",KING HENRY IV
2378,4.4.44,"And thou shalt prove a shelter to thy friends,",KING HENRY IV
2379,4.4.45,"A hoop of gold to bind thy brothers in,",KING HENRY IV
2380,4.4.46,"That the united vessel of their blood,",KING HENRY IV
2381,4.4.47,Mingled with venom of suggestion--,KING HENRY IV
2382,4.4.48,"As, force perforce, the age will pour it in--",KING HENRY IV
2383,4.4.49,"Shall never leak, though it do work as strong",KING HENRY IV
2384,4.4.50,As aconitum or rash gunpowder.,KING HENRY IV
2385,4.4.51,I shall observe him with all care and love.,CLARENCE
2386,4.4.52,"Why art thou not at Windsor with him, Thomas?",KING HENRY IV
2387,4.4.53,He is not there to-day; he dines in London.,CLARENCE
2388,4.4.54,And how accompanied? canst thou tell that?,KING HENRY IV
2389,4.4.55,"With Poins, and other his continual followers.",CLARENCE
2390,4.4.56,Most subject is the fattest soil to weeds;,KING HENRY IV
2391,4.4.57,"And he, the noble image of my youth,",KING HENRY IV
2392,4.4.58,Is overspread with them: therefore my grief,KING HENRY IV
2393,4.4.59,Stretches itself beyond the hour of death:,KING HENRY IV
2394,4.4.60,The blood weeps from my heart when I do shape,KING HENRY IV
2395,4.4.61,In forms imaginary the unguided days,KING HENRY IV
2396,4.4.62,And rotten times that you shall look upon,KING HENRY IV
2397,4.4.63,When I am sleeping with my ancestors.,KING HENRY IV
2398,4.4.64,"For when his headstrong riot hath no curb,",KING HENRY IV
2399,4.4.65,"When rage and hot blood are his counsellors,",KING HENRY IV
2400,4.4.66,"When means and lavish manners meet together,",KING HENRY IV
2401,4.4.67,"O, with what wings shall his affections fly",KING HENRY IV
2402,4.4.68,Towards fronting peril and opposed decay!,KING HENRY IV
2403,4.4.69,"My gracious lord, you look beyond him quite:",WARWICK
2404,4.4.70,The prince but studies his companions,WARWICK
2405,4.4.71,"Like a strange tongue, wherein, to gain the language,",WARWICK
2406,4.4.72,'Tis needful that the most immodest word,WARWICK
2407,4.4.73,"Be look'd upon and learn'd; which once attain'd,",WARWICK
2408,4.4.74,"Your highness knows, comes to no further use",WARWICK
2409,4.4.75,"But to be known and hated. So, like gross terms,",WARWICK
2410,4.4.76,The prince will in the perfectness of time,WARWICK
2411,4.4.77,Cast off his followers; and their memory,WARWICK
2412,4.4.78,"Shall as a pattern or a measure live,",WARWICK
2413,4.4.79,"By which his grace must mete the lives of others,",WARWICK
2414,4.4.80,Turning past evils to advantages.,WARWICK
2415,4.4.81,'Tis seldom when the bee doth leave her comb,KING HENRY IV
2416,4.4.82,In the dead carrion.,KING HENRY IV
2417,4.4.83,Who's here? Westmoreland?,KING HENRY IV
2418,4.4.84,"Health to my sovereign, and new happiness",WESTMORELAND
2419,4.4.85,Added to that that I am to deliver!,WESTMORELAND
2420,4.4.86,Prince John your son doth kiss your grace's hand:,WESTMORELAND
2421,4.4.87,"Mowbray, the Bishop Scroop, Hastings and all",WESTMORELAND
2422,4.4.88,Are brought to the correction of your law;,WESTMORELAND
2423,4.4.89,There is not now a rebel's sword unsheath'd,WESTMORELAND
2424,4.4.90,But peace puts forth her olive every where.,WESTMORELAND
2425,4.4.91,The manner how this action hath been borne,WESTMORELAND
2426,4.4.92,"Here at more leisure may your highness read,",WESTMORELAND
2427,4.4.93,With every course in his particular.,WESTMORELAND
2428,4.4.94,"O Westmoreland, thou art a summer bird,",KING HENRY IV
2429,4.4.95,Which ever in the haunch of winter sings,KING HENRY IV
2430,4.4.96,The lifting up of day.,KING HENRY IV
2431,4.4.97,"Look, here's more news.",KING HENRY IV
2432,4.4.98,From enemies heaven keep your majesty;,HARCOURT
2433,4.4.99,"And, when they stand against you, may they fall",HARCOURT
2434,4.4.100,As those that I am come to tell you of!,HARCOURT
2435,4.4.101,"The Earl Northumberland and the Lord Bardolph,",HARCOURT
2436,4.4.102,With a great power of English and of Scots,HARCOURT
2437,4.4.103,Are by the sheriff of Yorkshire overthrown:,HARCOURT
2438,4.4.104,The manner and true order of the fight,HARCOURT
2439,4.4.105,"This packet, please it you, contains at large.",HARCOURT
2440,4.4.106,And wherefore should these good news make me sick?,KING HENRY IV
2441,4.4.107,"Will fortune never come with both hands full,",KING HENRY IV
2442,4.4.108,But write her fair words still in foulest letters?,KING HENRY IV
2443,4.4.109,She either gives a stomach and no food;,KING HENRY IV
2444,4.4.110,"Such are the poor, in health; or else a feast",KING HENRY IV
2445,4.4.111,"And takes away the stomach; such are the rich,",KING HENRY IV
2446,4.4.112,That have abundance and enjoy it not.,KING HENRY IV
2447,4.4.113,I should rejoice now at this happy news;,KING HENRY IV
2448,4.4.114,"And now my sight fails, and my brain is giddy:",KING HENRY IV
2449,4.4.115,O me! come near me; now I am much ill.,KING HENRY IV
2450,4.4.116,"Comfort, your majesty!",GLOUCESTER
2451,4.4.117,O my royal father!,CLARENCE
2452,4.4.118,"My sovereign lord, cheer up yourself, look up.",WESTMORELAND
2453,4.4.119,"Be patient, princes; you do know, these fits",WARWICK
2454,4.4.120,Are with his highness very ordinary.,WARWICK
2455,4.4.121,Stand from him. Give him air; he'll straight be well.,WARWICK
2456,4.4.122,"No, no, he cannot long hold out these pangs:",CLARENCE
2457,4.4.123,The incessant care and labour of his mind,CLARENCE
2458,4.4.124,Hath wrought the mure that should confine it in,CLARENCE
2459,4.4.125,So thin that life looks through and will break out.,CLARENCE
2460,4.4.126,The people fear me; for they do observe,GLOUCESTER
2461,4.4.127,Unfather'd heirs and loathly births of nature:,GLOUCESTER
2462,4.4.128,"The seasons change their manners, as the year",GLOUCESTER
2463,4.4.129,Had found some months asleep and leap'd them over.,GLOUCESTER
2464,4.4.130,"The river hath thrice flow'd, no ebb between;",CLARENCE
2465,4.4.131,"And the old folk, time's doting chronicles,",CLARENCE
2466,4.4.132,Say it did so a little time before,CLARENCE
2467,4.4.133,"That our great-grandsire, Edward, sick'd and died.",CLARENCE
2468,4.4.134,"Speak lower, princes, for the king recovers.",WARWICK
2469,4.4.135,This apoplexy will certain be his end.,GLOUCESTER
2470,4.4.136,"I pray you, take me up, and bear me hence",KING HENRY IV
2471,4.4.137,"Into some other chamber: softly, pray.",KING HENRY IV
2472,4.5.1,"Let there be no noise made, my gentle friends;",KING HENRY IV
2473,4.5.2,Unless some dull and favourable hand,KING HENRY IV
2474,4.5.3,Will whisper music to my weary spirit.,KING HENRY IV
2475,4.5.4,Call for the music in the other room.,WARWICK
2476,4.5.5,Set me the crown upon my pillow here.,KING HENRY IV
2477,4.5.6,"His eye is hollow, and he changes much.",CLARENCE
2478,4.5.7,"Less noise, less noise!",WARWICK
2479,4.5.8,Who saw the Duke of Clarence?,PRINCE HENRY
2480,4.5.9,"I am here, brother, full of heaviness.",CLARENCE
2481,4.5.10,"How now! rain within doors, and none abroad!",PRINCE HENRY
2482,4.5.11,How doth the king?,PRINCE HENRY
2483,4.5.12,Exceeding ill.,GLOUCESTER
2484,4.5.13,                  Heard he the good news yet?,PRINCE HENRY
2485,4.5.14,Tell it him.,PRINCE HENRY
2486,4.5.15,He alter'd much upon the hearing it.,GLOUCESTER
2487,4.5.16,"If he be sick with joy, he'll recover without physic.",PRINCE HENRY
2488,4.5.17,"Not so much noise, my lords: sweet prince,",WARWICK
2489,4.5.18,speak low;,WARWICK
2490,4.5.19,The king your father is disposed to sleep.,WARWICK
2491,4.5.20,Let us withdraw into the other room.,CLARENCE
2492,4.5.21,Will't please your grace to go along with us?,WARWICK
2493,4.5.22,No; I will sit and watch here by the king.,PRINCE HENRY
2494,4.5.23,"Why doth the crown lie there upon his pillow,",PRINCE HENRY
2495,4.5.24,Being so troublesome a bedfellow?,PRINCE HENRY
2496,4.5.25,O polish'd perturbation! golden care!,PRINCE HENRY
2497,4.5.26,That keep'st the ports of slumber open wide,PRINCE HENRY
2498,4.5.27,To many a watchful night! sleep with it now!,PRINCE HENRY
2499,4.5.28,Yet not so sound and half so deeply sweet,PRINCE HENRY
2500,4.5.29,As he whose brow with homely biggen bound,PRINCE HENRY
2501,4.5.30,Snores out the watch of night. O majesty!,PRINCE HENRY
2502,4.5.31,"When thou dost pinch thy bearer, thou dost sit",PRINCE HENRY
2503,4.5.32,"Like a rich armour worn in heat of day,",PRINCE HENRY
2504,4.5.33,That scalds with safety. By his gates of breath,PRINCE HENRY
2505,4.5.34,There lies a downy feather which stirs not:,PRINCE HENRY
2506,4.5.35,"Did he suspire, that light and weightless down",PRINCE HENRY
2507,4.5.36,Perforce must move. My gracious lord! my father!,PRINCE HENRY
2508,4.5.37,"This sleep is sound indeed, this is a sleep",PRINCE HENRY
2509,4.5.38,That from this golden rigol hath divorced,PRINCE HENRY
2510,4.5.39,So many English kings. Thy due from me,PRINCE HENRY
2511,4.5.40,"Is tears and heavy sorrows of the blood,",PRINCE HENRY
2512,4.5.41,"Which nature, love, and filial tenderness,",PRINCE HENRY
2513,4.5.42,"Shall, O dear father, pay thee plenteously:",PRINCE HENRY
2514,4.5.43,"My due from thee is this imperial crown,",PRINCE HENRY
2515,4.5.44,"Which, as immediate as thy place and blood,",PRINCE HENRY
2516,4.5.45,"Derives itself to me. Lo, here it sits,",PRINCE HENRY
2517,4.5.46,Which God shall guard: and put the world's whole strength,PRINCE HENRY
2518,4.5.47,"Into one giant arm, it shall not force",PRINCE HENRY
2519,4.5.48,This lineal honour from me: this from thee,PRINCE HENRY
2520,4.5.49,"Will I to mine leave, as 'tis left to me.",PRINCE HENRY
2521,4.5.50,Warwick! Gloucester! Clarence!,KING HENRY IV
2522,4.5.51,Doth the king call?,CLARENCE
2523,4.5.52,What would your majesty? How fares your grace?,WARWICK
2524,4.5.53,"Why did you leave me here alone, my lords?",KING HENRY IV
2525,4.5.54,"We left the prince my brother here, my liege,",CLARENCE
2526,4.5.55,Who undertook to sit and watch by you.,CLARENCE
2527,4.5.56,The Prince of Wales! Where is he? let me see him:,KING HENRY IV
2528,4.5.57,He is not here.,KING HENRY IV
2529,4.5.58,This door is open; he is gone this way.,WARWICK
2530,4.5.59,He came not through the chamber where we stay'd.,GLOUCESTER
2531,4.5.60,Where is the crown? who took it from my pillow?,KING HENRY IV
2532,4.5.61,"When we withdrew, my liege, we left it here.",WARWICK
2533,4.5.62,"The prince hath ta'en it hence: go, seek him out.",KING HENRY IV
2534,4.5.63,Is he so hasty that he doth suppose,KING HENRY IV
2535,4.5.64,My sleep my death?,KING HENRY IV
2536,4.5.65,"Find him, my Lord of Warwick; chide him hither.",KING HENRY IV
2537,4.5.66,"This part of his conjoins with my disease,",KING HENRY IV
2538,4.5.67,"And helps to end me. See, sons, what things you are!",KING HENRY IV
2539,4.5.68,How quickly nature falls into revolt,KING HENRY IV
2540,4.5.69,When gold becomes her object!,KING HENRY IV
2541,4.5.70,For this the foolish over-careful fathers,KING HENRY IV
2542,4.5.71,"Have broke their sleep with thoughts, their brains with care,",KING HENRY IV
2543,4.5.72,Their bones with industry;,KING HENRY IV
2544,4.5.73,For this they have engrossed and piled up,KING HENRY IV
2545,4.5.74,The canker'd heaps of strange-achieved gold;,KING HENRY IV
2546,4.5.75,For this they have been thoughtful to invest,KING HENRY IV
2547,4.5.76,Their sons with arts and martial exercises:,KING HENRY IV
2548,4.5.77,"When, like the bee, culling from every flower",KING HENRY IV
2549,4.5.78,"The virtuous sweets,",KING HENRY IV
2550,4.5.79,"Our thighs pack'd with wax, our mouths with honey,",KING HENRY IV
2551,4.5.80,"We bring it to the hive, and, like the bees,",KING HENRY IV
2552,4.5.81,Are murdered for our pains. This bitter taste,KING HENRY IV
2553,4.5.82,Yield his engrossments to the ending father.,KING HENRY IV
2554,4.5.83,"Now, where is he that will not stay so long",KING HENRY IV
2555,4.5.84,Till his friend sickness hath determined me?,KING HENRY IV
2556,4.5.85,"My lord, I found the prince in the next room,",WARWICK
2557,4.5.86,"Washing with kindly tears his gentle cheeks,",WARWICK
2558,4.5.87,With such a deep demeanor in great sorrow,WARWICK
2559,4.5.88,"That tyranny, which never quaff'd but blood,",WARWICK
2560,4.5.89,"Would, by beholding him, have wash'd his knife",WARWICK
2561,4.5.90,With gentle eye-drops. He is coming hither.,WARWICK
2562,4.5.91,But wherefore did he take away the crown?,KING HENRY IV
2563,4.5.92,"Lo, where he comes. Come hither to me, Harry.",KING HENRY IV
2564,4.5.93,"Depart the chamber, leave us here alone.",KING HENRY IV
2565,4.5.94,I never thought to hear you speak again.,PRINCE HENRY
2566,4.5.95,"Thy wish was father, Harry, to that thought:",KING HENRY IV
2567,4.5.96,"I stay too long by thee, I weary thee.",KING HENRY IV
2568,4.5.97,Dost thou so hunger for mine empty chair,KING HENRY IV
2569,4.5.98,That thou wilt needs invest thee with my honours,KING HENRY IV
2570,4.5.99,Before thy hour be ripe? O foolish youth!,KING HENRY IV
2571,4.5.100,Thou seek'st the greatness that will o'erwhelm thee.,KING HENRY IV
2572,4.5.101,Stay but a little; for my cloud of dignity,KING HENRY IV
2573,4.5.102,Is held from falling with so weak a wind,KING HENRY IV
2574,4.5.103,That it will quickly drop: my day is dim.,KING HENRY IV
2575,4.5.104,Thou hast stolen that which after some few hours,KING HENRY IV
2576,4.5.105,Were thine without offence; and at my death,KING HENRY IV
2577,4.5.106,Thou hast seal'd up my expectation:,KING HENRY IV
2578,4.5.107,"Thy life did manifest thou lovedst me not,",KING HENRY IV
2579,4.5.108,And thou wilt have me die assured of it.,KING HENRY IV
2580,4.5.109,"Thou hidest a thousand daggers in thy thoughts,",KING HENRY IV
2581,4.5.110,"Which thou hast whetted on thy stony heart,",KING HENRY IV
2582,4.5.111,To stab at half an hour of my life.,KING HENRY IV
2583,4.5.112,What! canst thou not forbear me half an hour?,KING HENRY IV
2584,4.5.113,"Then get thee gone and dig my grave thyself,",KING HENRY IV
2585,4.5.114,And bid the merry bells ring to thine ear,KING HENRY IV
2586,4.5.115,"That thou art crowned, not that I am dead.",KING HENRY IV
2587,4.5.116,Let all the tears that should bedew my hearse,KING HENRY IV
2588,4.5.117,Be drops of balm to sanctify thy head:,KING HENRY IV
2589,4.5.118,Only compound me with forgotten dust,KING HENRY IV
2590,4.5.119,Give that which gave thee life unto the worms.,KING HENRY IV
2591,4.5.120,"Pluck down my officers, break my decrees;",KING HENRY IV
2592,4.5.121,For now a time is come to mock at form:,KING HENRY IV
2593,4.5.122,"Harry the Fifth is crown'd: up, vanity!",KING HENRY IV
2594,4.5.123,"Down, royal state! all you sage counsellors, hence!",KING HENRY IV
2595,4.5.124,"And to the English court assemble now,",KING HENRY IV
2596,4.5.125,"From every region, apes of idleness!",KING HENRY IV
2597,4.5.126,"Now, neighbour confines, purge you of your scum:",KING HENRY IV
2598,4.5.127,"Have you a ruffian that will swear, drink, dance,",KING HENRY IV
2599,4.5.128,"Revel the night, rob, murder, and commit",KING HENRY IV
2600,4.5.129,The oldest sins the newest kind of ways?,KING HENRY IV
2601,4.5.130,"Be happy, he will trouble you no more;",KING HENRY IV
2602,4.5.131,"England shall double gild his treble guilt,",KING HENRY IV
2603,4.5.132,"England shall give him office, honour, might;",KING HENRY IV
2604,4.5.133,For the fifth Harry from curb'd licence plucks,KING HENRY IV
2605,4.5.134,"The muzzle of restraint, and the wild dog",KING HENRY IV
2606,4.5.135,Shall flesh his tooth on every innocent.,KING HENRY IV
2607,4.5.136,"O my poor kingdom, sick with civil blows!",KING HENRY IV
2608,4.5.137,"When that my care could not withhold thy riots,",KING HENRY IV
2609,4.5.138,What wilt thou do when riot is thy care?,KING HENRY IV
2610,4.5.139,"O, thou wilt be a wilderness again,",KING HENRY IV
2611,4.5.140,"Peopled with wolves, thy old inhabitants!",KING HENRY IV
2612,4.5.141,"O, pardon me, my liege! but for my tears,",PRINCE HENRY
2613,4.5.142,"The moist impediments unto my speech,",PRINCE HENRY
2614,4.5.143,I had forestall'd this dear and deep rebuke,PRINCE HENRY
2615,4.5.144,Ere you with grief had spoke and I had heard,PRINCE HENRY
2616,4.5.145,The course of it so far. There is your crown;,PRINCE HENRY
2617,4.5.146,And He that wears the crown immortally,PRINCE HENRY
2618,4.5.147,Long guard it yours! If I affect it more,PRINCE HENRY
2619,4.5.148,"Than as your honour and as your renown,",PRINCE HENRY
2620,4.5.149,"Let me no more from this obedience rise,",PRINCE HENRY
2621,4.5.150,Which my most inward true and duteous spirit,PRINCE HENRY
2622,4.5.151,"Teacheth, this prostrate and exterior bending.",PRINCE HENRY
2623,4.5.152,"God witness with me, when I here came in,",PRINCE HENRY
2624,4.5.153,"And found no course of breath within your majesty,",PRINCE HENRY
2625,4.5.154,"How cold it struck my heart! If I do feign,",PRINCE HENRY
2626,4.5.155,"O, let me in my present wildness die",PRINCE HENRY
2627,4.5.156,And never live to show the incredulous world,PRINCE HENRY
2628,4.5.157,The noble change that I have purposed!,PRINCE HENRY
2629,4.5.158,"Coming to look on you, thinking you dead,",PRINCE HENRY
2630,4.5.159,"And dead almost, my liege, to think you were,",PRINCE HENRY
2631,4.5.160,"I spake unto this crown as having sense,",PRINCE HENRY
2632,4.5.161,And thus upbraided it: 'The care on thee depending,PRINCE HENRY
2633,4.5.162,Hath fed upon the body of my father;,PRINCE HENRY
2634,4.5.163,"Therefore, thou best of gold art worst of gold:",PRINCE HENRY
2635,4.5.164,"Other, less fine in carat, is more precious,",PRINCE HENRY
2636,4.5.165,Preserving life in medicine potable;,PRINCE HENRY
2637,4.5.166,"But thou, most fine, most honour'd: most renown'd,",PRINCE HENRY
2638,4.5.167,"Hast eat thy bearer up.' Thus, my most royal liege,",PRINCE HENRY
2639,4.5.168,"Accusing it, I put it on my head,",PRINCE HENRY
2640,4.5.169,"To try with it, as with an enemy",PRINCE HENRY
2641,4.5.170,"That had before my face murder'd my father,",PRINCE HENRY
2642,4.5.171,The quarrel of a true inheritor.,PRINCE HENRY
2643,4.5.172,"But if it did infect my blood with joy,",PRINCE HENRY
2644,4.5.173,Or swell my thoughts to any strain of pride;,PRINCE HENRY
2645,4.5.174,If any rebel or vain spirit of mine,PRINCE HENRY
2646,4.5.175,Did with the least affection of a welcome,PRINCE HENRY
2647,4.5.176,"Give entertainment to the might of it,",PRINCE HENRY
2648,4.5.177,Let God for ever keep it from my head,PRINCE HENRY
2649,4.5.178,And make me as the poorest vassal is,PRINCE HENRY
2650,4.5.179,That doth with awe and terror kneel to it!,PRINCE HENRY
2651,4.5.180,"O my son,",KING HENRY IV
2652,4.5.181,"God put it in thy mind to take it hence,",KING HENRY IV
2653,4.5.182,"That thou mightst win the more thy father's love,",KING HENRY IV
2654,4.5.183,Pleading so wisely in excuse of it!,KING HENRY IV
2655,4.5.184,"Come hither, Harry, sit thou by my bed;",KING HENRY IV
2656,4.5.185,"And hear, I think, the very latest counsel",KING HENRY IV
2657,4.5.186,"That ever I shall breathe. God knows, my son,",KING HENRY IV
2658,4.5.187,By what by-paths and indirect crook'd ways,KING HENRY IV
2659,4.5.188,I met this crown; and I myself know well,KING HENRY IV
2660,4.5.189,How troublesome it sat upon my head.,KING HENRY IV
2661,4.5.190,"To thee it shall descend with bitter quiet,",KING HENRY IV
2662,4.5.191,"Better opinion, better confirmation;",KING HENRY IV
2663,4.5.192,For all the soil of the achievement goes,KING HENRY IV
2664,4.5.193,With me into the earth. It seem'd in me,KING HENRY IV
2665,4.5.194,"But as an honour snatch'd with boisterous hand,",KING HENRY IV
2666,4.5.195,And I had many living to upbraid,KING HENRY IV
2667,4.5.196,My gain of it by their assistances;,KING HENRY IV
2668,4.5.197,"Which daily grew to quarrel and to bloodshed,",KING HENRY IV
2669,4.5.198,Wounding supposed peace: all these bold fears,KING HENRY IV
2670,4.5.199,Thou see'st with peril I have answered;,KING HENRY IV
2671,4.5.200,For all my reign hath been but as a scene,KING HENRY IV
2672,4.5.201,Acting that argument: and now my death,KING HENRY IV
2673,4.5.202,"Changes the mode; for what in me was purchased,",KING HENRY IV
2674,4.5.203,Falls upon thee in a more fairer sort;,KING HENRY IV
2675,4.5.204,So thou the garland wear'st successively.,KING HENRY IV
2676,4.5.205,"Yet, though thou stand'st more sure than I could do,",KING HENRY IV
2677,4.5.206,"Thou art not firm enough, since griefs are green;",KING HENRY IV
2678,4.5.207,"And all my friends, which thou must make thy friends,",KING HENRY IV
2679,4.5.208,Have but their stings and teeth newly ta'en out;,KING HENRY IV
2680,4.5.209,By whose fell working I was first advanced,KING HENRY IV
2681,4.5.210,And by whose power I well might lodge a fear,KING HENRY IV
2682,4.5.211,"To be again displaced: which to avoid,",KING HENRY IV
2683,4.5.212,I cut them off; and had a purpose now,KING HENRY IV
2684,4.5.213,"To lead out many to the Holy Land,",KING HENRY IV
2685,4.5.214,Lest rest and lying still might make them look,KING HENRY IV
2686,4.5.215,"Too near unto my state. Therefore, my Harry,",KING HENRY IV
2687,4.5.216,Be it thy course to busy giddy minds,KING HENRY IV
2688,4.5.217,"With foreign quarrels; that action, hence borne out,",KING HENRY IV
2689,4.5.218,May waste the memory of the former days.,KING HENRY IV
2690,4.5.219,"More would I, but my lungs are wasted so",KING HENRY IV
2691,4.5.220,That strength of speech is utterly denied me.,KING HENRY IV
2692,4.5.221,"How I came by the crown, O God forgive;",KING HENRY IV
2693,4.5.222,And grant it may with thee in true peace live!,KING HENRY IV
2694,4.5.223,"My gracious liege,",PRINCE HENRY
2695,4.5.224,"You won it, wore it, kept it, gave it me;",PRINCE HENRY
2696,4.5.225,Then plain and right must my possession be:,PRINCE HENRY
2697,4.5.226,Which I with more than with a common pain,PRINCE HENRY
2698,4.5.227,'Gainst all the world will rightfully maintain.,PRINCE HENRY
2699,4.5.228,"Look, look, here comes my John of Lancaster.",KING HENRY IV
2700,4.5.229,"Health, peace, and happiness to my royal father!",LANCASTER
2701,4.5.230,"Thou bring'st me happiness and peace, son John;",KING HENRY IV
2702,4.5.231,"But health, alack, with youthful wings is flown",KING HENRY IV
2703,4.5.232,From this bare wither'd trunk: upon thy sight,KING HENRY IV
2704,4.5.233,My worldly business makes a period.,KING HENRY IV
2705,4.5.234,Where is my Lord of Warwick?,KING HENRY IV
2706,4.5.235,My Lord of Warwick!,PRINCE HENRY
2707,4.5.236,Doth any name particular belong,KING HENRY IV
2708,4.5.237,Unto the lodging where I first did swoon?,KING HENRY IV
