,LineNos,Lines,Speakers
1593,4.1.70,Even in the matter of mine innocence;,ARTHUR
1594,4.1.71,"Nay, after that, consume away in rust",ARTHUR
1595,4.1.72,But for containing fire to harm mine eye.,ARTHUR
1596,4.1.73,Are you more stubborn-hard than hammer'd iron?,ARTHUR
1597,4.1.74,An if an angel should have come to me,ARTHUR
1598,4.1.75,"And told me Hubert should put out mine eyes,",ARTHUR
1599,4.1.76,"I would not have believed him,--no tongue but Hubert's.",ARTHUR
1600,4.1.77,Come forth.,HUBERT
1601,4.1.78,Do as I bid you do.,HUBERT
1602,4.1.79,"O, save me, Hubert, save me! my eyes are out",ARTHUR
1603,4.1.80,Even with the fierce looks of these bloody men.,ARTHUR
1604,4.1.81,"Give me the iron, I say, and bind him here.",HUBERT
1605,4.1.82,"Alas, what need you be so boisterous-rough?",ARTHUR
1606,4.1.83,"I will not struggle, I will stand stone-still.",ARTHUR
1607,4.1.84,"For heaven sake, Hubert, let me not be bound!",ARTHUR
1608,4.1.85,"Nay, hear me, Hubert, drive these men away,",ARTHUR
1609,4.1.86,And I will sit as quiet as a lamb;,ARTHUR
1610,4.1.87,"I will not stir, nor wince, nor speak a word,",ARTHUR
1611,4.1.88,Nor look upon the iron angerly:,ARTHUR
1612,4.1.89,"Thrust but these men away, and I'll forgive you,",ARTHUR
1613,4.1.90,Whatever torment you do put me to.,ARTHUR
1614,4.1.91,"Go, stand within; let me alone with him.",HUBERT
1615,4.1.92,I am best pleased to be from such a deed.,First Executioner
1616,4.1.93,"Alas, I then have chid away my friend!",ARTHUR
1617,4.1.94,"He hath a stern look, but a gentle heart:",ARTHUR
1618,4.1.95,"Let him come back, that his compassion may",ARTHUR
1619,4.1.96,Give life to yours.,ARTHUR
1620,4.1.97,"Come, boy, prepare yourself.",HUBERT
1621,4.1.98,Is there no remedy?,ARTHUR
1622,4.1.99,"None, but to lose your eyes.",HUBERT
1623,4.1.100,"O heaven, that there were but a mote in yours,",ARTHUR
1624,4.1.101,"A grain, a dust, a gnat, a wandering hair,",ARTHUR
1625,4.1.102,Any annoyance in that precious sense!,ARTHUR
1626,4.1.103,"Then feeling what small things are boisterous there,",ARTHUR
1627,4.1.104,Your vile intent must needs seem horrible.,ARTHUR
1628,4.1.105,"Is this your promise? go to, hold your tongue.",HUBERT
1629,4.1.106,"Hubert, the utterance of a brace of tongues",ARTHUR
1630,4.1.107,Must needs want pleading for a pair of eyes:,ARTHUR
1631,4.1.108,"Let me not hold my tongue, let me not, Hubert;",ARTHUR
1632,4.1.109,"Or, Hubert, if you will, cut out my tongue,",ARTHUR
1633,4.1.110,"So I may keep mine eyes: O, spare mine eyes.",ARTHUR
1634,4.1.111,Though to no use but still to look on you!,ARTHUR
1635,4.1.112,"Lo, by my truth, the instrument is cold",ARTHUR
1636,4.1.113,And would not harm me.,ARTHUR
1637,4.1.114,"I can heat it, boy.",HUBERT
1638,4.1.115,"No, in good sooth: the fire is dead with grief,",ARTHUR
1639,4.1.116,"Being create for comfort, to be used",ARTHUR
1640,4.1.117,In undeserved extremes: see else yourself;,ARTHUR
1641,4.1.118,There is no malice in this burning coal;,ARTHUR
1642,4.1.119,The breath of heaven has blown his spirit out,ARTHUR
1643,4.1.120,And strew'd repentent ashes on his head.,ARTHUR
1644,4.1.121,"But with my breath I can revive it, boy.",HUBERT
1645,4.1.122,"An if you do, you will but make it blush",ARTHUR
1646,4.1.123,"And glow with shame of your proceedings, Hubert:",ARTHUR
1647,4.1.124,"Nay, it perchance will sparkle in your eyes;",ARTHUR
1648,4.1.125,"And like a dog that is compell'd to fight,",ARTHUR
1649,4.1.126,Snatch at his master that doth tarre him on.,ARTHUR
1650,4.1.127,All things that you should use to do me wrong,ARTHUR
1651,4.1.128,Deny their office: only you do lack,ARTHUR
1652,4.1.129,"That mercy which fierce fire and iron extends,",ARTHUR
1653,4.1.130,Creatures of note for mercy-lacking uses.,ARTHUR
1654,4.1.131,"Well, see to live; I will not touch thine eye",HUBERT
1655,4.1.132,For all the treasure that thine uncle owes:,HUBERT
1656,4.1.133,"Yet am I sworn and I did purpose, boy,",HUBERT
1657,4.1.134,With this same very iron to burn them out.,HUBERT
1658,4.1.135,"O, now you look like Hubert! all this while",ARTHUR
1659,4.1.136,You were disguised.,ARTHUR
1660,4.1.137,Peace; no more. Adieu.,HUBERT
1661,4.1.138,Your uncle must not know but you are dead;,HUBERT
1662,4.1.139,I'll fill these dogged spies with false reports:,HUBERT
1663,4.1.140,"And, pretty child, sleep doubtless and secure,",HUBERT
1664,4.1.141,"That Hubert, for the wealth of all the world,",HUBERT
1665,4.1.142,Will not offend thee.,HUBERT
1666,4.1.143,"O heaven! I thank you, Hubert.",ARTHUR
1667,4.1.144,Silence; no more: go closely in with me:,HUBERT
1668,4.1.145,Much danger do I undergo for thee.,HUBERT
1669,4.2.1,"Here once again we sit, once again crown'd,",KING JOHN
1670,4.2.2,"And looked upon, I hope, with cheerful eyes.",KING JOHN
1671,4.2.3,"This 'once again,' but that your highness pleased,",PEMBROKE
1672,4.2.4,"Was once superfluous: you were crown'd before,",PEMBROKE
1673,4.2.5,"And that high royalty was ne'er pluck'd off,",PEMBROKE
1674,4.2.6,The faiths of men ne'er stained with revolt;,PEMBROKE
1675,4.2.7,Fresh expectation troubled not the land,PEMBROKE
1676,4.2.8,With any long'd-for change or better state.,PEMBROKE
1677,4.2.9,"Therefore, to be possess'd with double pomp,",SALISBURY
1678,4.2.10,"To guard a title that was rich before,",SALISBURY
1679,4.2.11,"To gild refined gold, to paint the lily,",SALISBURY
1680,4.2.12,"To throw a perfume on the violet,",SALISBURY
1681,4.2.13,"To smooth the ice, or add another hue",SALISBURY
1682,4.2.14,"Unto the rainbow, or with taper-light",SALISBURY
1683,4.2.15,"To seek the beauteous eye of heaven to garnish,",SALISBURY
1684,4.2.16,Is wasteful and ridiculous excess.,SALISBURY
1685,4.2.17,"But that your royal pleasure must be done,",PEMBROKE
1686,4.2.18,"This act is as an ancient tale new told,",PEMBROKE
1687,4.2.19,"And in the last repeating troublesome,",PEMBROKE
1688,4.2.20,Being urged at a time unseasonable.,PEMBROKE
1689,4.2.21,In this the antique and well noted face,SALISBURY
1690,4.2.22,Of plain old form is much disfigured;,SALISBURY
1691,4.2.23,"And, like a shifted wind unto a sail,",SALISBURY
1692,4.2.24,"It makes the course of thoughts to fetch about,",SALISBURY
1693,4.2.25,"Startles and frights consideration,",SALISBURY
1694,4.2.26,"Makes sound opinion sick and truth suspected,",SALISBURY
1695,4.2.27,For putting on so new a fashion'd robe.,SALISBURY
1696,4.2.28,"When workmen strive to do better than well,",PEMBROKE
1697,4.2.29,They do confound their skill in covetousness;,PEMBROKE
1698,4.2.30,And oftentimes excusing of a fault,PEMBROKE
1699,4.2.31,"Doth make the fault the worse by the excuse,",PEMBROKE
1700,4.2.32,As patches set upon a little breach,PEMBROKE
1701,4.2.33,Discredit more in hiding of the fault,PEMBROKE
1702,4.2.34,Than did the fault before it was so patch'd.,PEMBROKE
1703,4.2.35,"To this effect, before you were new crown'd,",SALISBURY
1704,4.2.36,We breathed our counsel: but it pleased your highness,SALISBURY
1705,4.2.37,"To overbear it, and we are all well pleased,",SALISBURY
1706,4.2.38,Since all and every part of what we would,SALISBURY
1707,4.2.39,Doth make a stand at what your highness will.,SALISBURY
1708,4.2.40,Some reasons of this double coronation,KING JOHN
1709,4.2.41,I have possess'd you with and think them strong;,KING JOHN
1710,4.2.42,"And more, more strong, then lesser is my fear,",KING JOHN
1711,4.2.43,I shall indue you with: meantime but ask,KING JOHN
1712,4.2.44,"What you would have reform'd that is not well,",KING JOHN
1713,4.2.45,And well shall you perceive how willingly,KING JOHN
1714,4.2.46,I will both hear and grant you your requests.,KING JOHN
1715,4.2.47,"Then I, as one that am the tongue of these,",PEMBROKE
1716,4.2.48,"To sound the purpose of all their hearts,",PEMBROKE
1717,4.2.49,"Both for myself and them, but, chief of all,",PEMBROKE
1718,4.2.50,"Your safety, for the which myself and them",PEMBROKE
1719,4.2.51,"Bend their best studies, heartily request",PEMBROKE
1720,4.2.52,The enfranchisement of Arthur; whose restraint,PEMBROKE
1721,4.2.53,Doth move the murmuring lips of discontent,PEMBROKE
1722,4.2.54,"To break into this dangerous argument,--",PEMBROKE
1723,4.2.55,"If what in rest you have in right you hold,",PEMBROKE
1724,4.2.56,"Why then your fears, which, as they say, attend",PEMBROKE
1725,4.2.57,"The steps of wrong, should move you to mew up",PEMBROKE
1726,4.2.58,Your tender kinsman and to choke his days,PEMBROKE
1727,4.2.59,With barbarous ignorance and deny his youth,PEMBROKE
1728,4.2.60,The rich advantage of good exercise?,PEMBROKE
1729,4.2.61,That the time's enemies may not have this,PEMBROKE
1730,4.2.62,"To grace occasions, let it be our suit",PEMBROKE
1731,4.2.63,That you have bid us ask his liberty;,PEMBROKE
1732,4.2.64,Which for our goods we do no further ask,PEMBROKE
1733,4.2.65,"Than whereupon our weal, on you depending,",PEMBROKE
1734,4.2.66,Counts it your weal he have his liberty.,PEMBROKE
1735,4.2.67,Let it be so: I do commit his youth,KING JOHN
1736,4.2.68,"To your direction. Hubert, what news with you?",KING JOHN
1737,4.2.69,This is the man should do the bloody deed;,PEMBROKE
1738,4.2.70,He show'd his warrant to a friend of mine:,PEMBROKE
1739,4.2.71,The image of a wicked heinous fault,PEMBROKE
1740,4.2.72,Lives in his eye; that close aspect of his,PEMBROKE
1741,4.2.73,Does show the mood of a much troubled breast;,PEMBROKE
1742,4.2.74,"And I do fearfully believe 'tis done,",PEMBROKE
1743,4.2.75,What we so fear'd he had a charge to do.,PEMBROKE
1744,4.2.76,The colour of the king doth come and go,SALISBURY
1745,4.2.77,"Between his purpose and his conscience,",SALISBURY
1746,4.2.78,Like heralds 'twixt two dreadful battles set:,SALISBURY
1747,4.2.79,"His passion is so ripe, it needs must break.",SALISBURY
1748,4.2.80,"And when it breaks, I fear will issue thence",PEMBROKE
1749,4.2.81,The foul corruption of a sweet child's death.,PEMBROKE
1750,4.2.82,We cannot hold mortality's strong hand:,KING JOHN
1751,4.2.83,"Good lords, although my will to give is living,",KING JOHN
1752,4.2.84,The suit which you demand is gone and dead:,KING JOHN
1753,4.2.85,He tells us Arthur is deceased to-night.,KING JOHN
1754,4.2.86,Indeed we fear'd his sickness was past cure.,SALISBURY
1755,4.2.87,Indeed we heard how near his death he was,PEMBROKE
1756,4.2.88,Before the child himself felt he was sick:,PEMBROKE
1757,4.2.89,This must be answer'd either here or hence.,PEMBROKE
1758,4.2.90,Why do you bend such solemn brows on me?,KING JOHN
1759,4.2.91,Think you I bear the shears of destiny?,KING JOHN
1760,4.2.92,Have I commandment on the pulse of life?,KING JOHN
1761,4.2.93,It is apparent foul play; and 'tis shame,SALISBURY
1762,4.2.94,That greatness should so grossly offer it:,SALISBURY
1763,4.2.95,"So thrive it in your game! and so, farewell.",SALISBURY
1764,4.2.96,"Stay yet, Lord Salisbury; I'll go with thee,",PEMBROKE
1765,4.2.97,"And find the inheritance of this poor child,",PEMBROKE
1766,4.2.98,His little kingdom of a forced grave.,PEMBROKE
1767,4.2.99,"That blood which owed the breadth of all this isle,",PEMBROKE
1768,4.2.100,Three foot of it doth hold: bad world the while!,PEMBROKE
1769,4.2.101,This must not be thus borne: this will break out,PEMBROKE
1770,4.2.102,"To all our sorrows, and ere long I doubt.",PEMBROKE
1771,4.2.103,They burn in indignation. I repent:,KING JOHN
1772,4.2.104,"There is no sure foundation set on blood,",KING JOHN
1773,4.2.105,No certain life achieved by others' death.,KING JOHN
1774,4.2.106,A fearful eye thou hast: where is that blood,KING JOHN
1775,4.2.107,That I have seen inhabit in those cheeks?,KING JOHN
1776,4.2.108,So foul a sky clears not without a storm:,KING JOHN
1777,4.2.109,Pour down thy weather: how goes all in France?,KING JOHN
1778,4.2.110,From France to England. Never such a power,Messenger
1779,4.2.111,For any foreign preparation,Messenger
1780,4.2.112,Was levied in the body of a land.,Messenger
1781,4.2.113,The copy of your speed is learn'd by them;,Messenger
1782,4.2.114,"For when you should be told they do prepare,",Messenger
1783,4.2.115,The tidings come that they are all arrived.,Messenger
1784,4.2.116,"O, where hath our intelligence been drunk?",KING JOHN
1785,4.2.117,"Where hath it slept? Where is my mother's care,",KING JOHN
1786,4.2.118,"That such an army could be drawn in France,",KING JOHN
1787,4.2.119,And she not hear of it?,KING JOHN
1788,4.2.120,"My liege, her ear",Messenger
1789,4.2.121,Is stopp'd with dust; the first of April died,Messenger
1790,4.2.122,"Your noble mother: and, as I hear, my lord,",Messenger
1791,4.2.123,The Lady Constance in a frenzy died,Messenger
1792,4.2.124,Three days before: but this from rumour's tongue,Messenger
1793,4.2.125,I idly heard; if true or false I know not.,Messenger
1794,4.2.126,"Withhold thy speed, dreadful occasion!",KING JOHN
1795,4.2.127,"O, make a league with me, till I have pleased",KING JOHN
1796,4.2.128,My discontented peers! What! mother dead!,KING JOHN
1797,4.2.129,How wildly then walks my estate in France!,KING JOHN
1798,4.2.130,Under whose conduct came those powers of France,KING JOHN
1799,4.2.131,That thou for truth givest out are landed here?,KING JOHN
1800,4.2.132,Under the Dauphin.,Messenger
1801,4.2.133,                  Thou hast made me giddy,KING JOHN
1802,4.2.134,With these ill tidings.,KING JOHN
1803,4.2.135,"Now, what says the world",KING JOHN
1804,4.2.136,To your proceedings? do not seek to stuff,KING JOHN
1805,4.2.137,"My head with more ill news, for it is full.",KING JOHN
1806,4.2.138,"But if you be afeard to hear the worst,",BASTARD
1807,4.2.139,Then let the worst unheard fall on your bead.,BASTARD
1808,4.2.140,"Bear with me cousin, for I was amazed",KING JOHN
1809,4.2.141,Under the tide: but now I breathe again,KING JOHN
1810,4.2.142,"Aloft the flood, and can give audience",KING JOHN
1811,4.2.143,"To any tongue, speak it of what it will.",KING JOHN
1812,4.2.144,"How I have sped among the clergymen,",BASTARD
1813,4.2.145,The sums I have collected shall express.,BASTARD
1814,4.2.146,"But as I travell'd hither through the land,",BASTARD
1815,4.2.147,I find the people strangely fantasied;,BASTARD
1816,4.2.148,"Possess'd with rumours, full of idle dreams,",BASTARD
1817,4.2.149,"Not knowing what they fear, but full of fear:",BASTARD
1818,4.2.150,"And here a prophet, that I brought with me",BASTARD
1819,4.2.151,"From forth the streets of Pomfret, whom I found",BASTARD
1820,4.2.152,With many hundreds treading on his heels;,BASTARD
1821,4.2.153,"To whom he sung, in rude harsh-sounding rhymes,",BASTARD
1822,4.2.154,"That, ere the next Ascension-day at noon,",BASTARD
1823,4.2.155,Your highness should deliver up your crown.,BASTARD
1824,4.2.156,"Thou idle dreamer, wherefore didst thou so?",KING JOHN
1825,4.2.157,Foreknowing that the truth will fall out so.,PETER
1826,4.2.158,"Hubert, away with him; imprison him;",KING JOHN
1827,4.2.159,And on that day at noon whereon he says,KING JOHN
1828,4.2.160,"I shall yield up my crown, let him be hang'd.",KING JOHN
1829,4.2.161,"Deliver him to safety; and return,",KING JOHN
1830,4.2.162,For I must use thee.,KING JOHN
1831,4.2.163,"O my gentle cousin,",KING JOHN
1832,4.2.164,"Hear'st thou the news abroad, who are arrived?",KING JOHN
1833,4.2.165,"The French, my lord; men's mouths are full of it:",BASTARD
1834,4.2.166,"Besides, I met Lord Bigot and Lord Salisbury,",BASTARD
1835,4.2.167,"With eyes as red as new-enkindled fire,",BASTARD
1836,4.2.168,"And others more, going to seek the grave",BASTARD
1837,4.2.169,"Of Arthur, who they say is kill'd to-night",BASTARD
1838,4.2.170,On your suggestion.,BASTARD
1839,4.2.171,"Gentle kinsman, go,",KING JOHN
1840,4.2.172,And thrust thyself into their companies:,KING JOHN
1841,4.2.173,I have a way to win their loves again;,KING JOHN
1842,4.2.174,Bring them before me.,KING JOHN
1843,4.2.175,I will seek them out.,BASTARD
1844,4.2.176,"Nay, but make haste; the better foot before.",KING JOHN
1845,4.2.177,"O, let me have no subject enemies,",KING JOHN
1846,4.2.178,When adverse foreigners affright my towns,KING JOHN
1847,4.2.179,With dreadful pomp of stout invasion!,KING JOHN
1848,4.2.180,"Be Mercury, set feathers to thy heels,",KING JOHN
1849,4.2.181,And fly like thought from them to me again.,KING JOHN
1850,4.2.182,The spirit of the time shall teach me speed.,BASTARD
1851,4.2.183,Spoke like a sprightful noble gentleman.,KING JOHN
1852,4.2.184,Go after him; for he perhaps shall need,KING JOHN
1853,4.2.185,Some messenger betwixt me and the peers;,KING JOHN
1854,4.2.186,And be thou he.,KING JOHN
1855,4.2.187,"                  With all my heart, my liege.",Messenger
1856,4.2.188,My mother dead!,KING JOHN
1857,4.2.189,"My lord, they say five moons were seen to-night;",HUBERT
1858,4.2.190,"Four fixed, and the fifth did whirl about",HUBERT
1859,4.2.191,The other four in wondrous motion.,HUBERT
1860,4.2.192,Five moons!,KING JOHN
1861,4.2.193,Old men and beldams in the streets,HUBERT
1862,4.2.194,Do prophesy upon it dangerously:,HUBERT
1863,4.2.195,Young Arthur's death is common in their mouths:,HUBERT
1864,4.2.196,"And when they talk of him, they shake their heads",HUBERT
1865,4.2.197,And whisper one another in the ear;,HUBERT
1866,4.2.198,"And he that speaks doth gripe the hearer's wrist,",HUBERT
1867,4.2.199,"Whilst he that hears makes fearful action,",HUBERT
1868,4.2.200,"With wrinkled brows, with nods, with rolling eyes.",HUBERT
1869,4.2.201,"I saw a smith stand with his hammer, thus,",HUBERT
1870,4.2.202,"The whilst his iron did on the anvil cool,",HUBERT
1871,4.2.203,With open mouth swallowing a tailor's news;,HUBERT
1872,4.2.204,"Who, with his shears and measure in his hand,",HUBERT
1873,4.2.205,"Standing on slippers, which his nimble haste",HUBERT
1874,4.2.206,"Had falsely thrust upon contrary feet,",HUBERT
1875,4.2.207,Told of a many thousand warlike French,HUBERT
1876,4.2.208,That were embattailed and rank'd in Kent:,HUBERT
1877,4.2.209,Another lean unwash'd artificer,HUBERT
1878,4.2.210,Cuts off his tale and talks of Arthur's death.,HUBERT
1879,4.2.211,Why seek'st thou to possess me with these fears?,KING JOHN
1880,4.2.212,Why urgest thou so oft young Arthur's death?,KING JOHN
1881,4.2.213,Thy hand hath murder'd him: I had a mighty cause,KING JOHN
1882,4.2.214,"To wish him dead, but thou hadst none to kill him.",KING JOHN
1883,4.2.215,"No had, my lord! why, did you not provoke me?",HUBERT
1884,4.2.216,It is the curse of kings to be attended,KING JOHN
1885,4.2.217,By slaves that take their humours for a warrant,KING JOHN
1886,4.2.218,"To break within the bloody house of life,",KING JOHN
1887,4.2.219,And on the winking of authority,KING JOHN
1888,4.2.220,"To understand a law, to know the meaning",KING JOHN
1889,4.2.221,"Of dangerous majesty, when perchance it frowns",KING JOHN
1890,4.2.222,More upon humour than advised respect.,KING JOHN
1891,4.2.223,Here is your hand and seal for what I did.,HUBERT
1892,4.2.224,"O, when the last account 'twixt heaven and earth",KING JOHN
1893,4.2.225,"Is to be made, then shall this hand and seal",KING JOHN
1894,4.2.226,Witness against us to damnation!,KING JOHN
1895,4.2.227,How oft the sight of means to do ill deeds,KING JOHN
1896,4.2.228,"Make deeds ill done! Hadst not thou been by,",KING JOHN
1897,4.2.229,"A fellow by the hand of nature mark'd,",KING JOHN
1898,4.2.230,"Quoted and sign'd to do a deed of shame,",KING JOHN
1899,4.2.231,This murder had not come into my mind:,KING JOHN
1900,4.2.232,"But taking note of thy abhorr'd aspect,",KING JOHN
1901,4.2.233,"Finding thee fit for bloody villany,",KING JOHN
1902,4.2.234,"Apt, liable to be employ'd in danger,",KING JOHN
1903,4.2.235,I faintly broke with thee of Arthur's death;,KING JOHN
1904,4.2.236,"And thou, to be endeared to a king,",KING JOHN
1905,4.2.237,Made it no conscience to destroy a prince.,KING JOHN
1906,4.2.238,My lord--,HUBERT
1907,4.2.239,Hadst thou but shook thy head or made a pause,KING JOHN
1908,4.2.240,"When I spake darkly what I purposed,",KING JOHN
1909,4.2.241,"Or turn'd an eye of doubt upon my face,",KING JOHN
1910,4.2.242,"As bid me tell my tale in express words,",KING JOHN
1911,4.2.243,"Deep shame had struck me dumb, made me break off,",KING JOHN
1912,4.2.244,And those thy fears might have wrought fears in me:,KING JOHN
1913,4.2.245,But thou didst understand me by my signs,KING JOHN
1914,4.2.246,And didst in signs again parley with sin;,KING JOHN
1915,4.2.247,"Yea, without stop, didst let thy heart consent,",KING JOHN
1916,4.2.248,And consequently thy rude hand to act,KING JOHN
1917,4.2.249,"The deed, which both our tongues held vile to name.",KING JOHN
1918,4.2.250,"Out of my sight, and never see me more!",KING JOHN
1919,4.2.251,"My nobles leave me; and my state is braved,",KING JOHN
1920,4.2.252,"Even at my gates, with ranks of foreign powers:",KING JOHN
1921,4.2.253,"Nay, in the body of this fleshly land,",KING JOHN
1922,4.2.254,"This kingdom, this confine of blood and breath,",KING JOHN
1923,4.2.255,Hostility and civil tumult reigns,KING JOHN
1924,4.2.256,Between my conscience and my cousin's death.,KING JOHN
1925,4.2.257,"Arm you against your other enemies,",HUBERT
1926,4.2.258,I'll make a peace between your soul and you.,HUBERT
1927,4.2.259,Young Arthur is alive: this hand of mine,HUBERT
1928,4.2.260,"Is yet a maiden and an innocent hand,",HUBERT
1929,4.2.261,Not painted with the crimson spots of blood.,HUBERT
1930,4.2.262,Within this bosom never enter'd yet,HUBERT
1931,4.2.263,The dreadful motion of a murderous thought;,HUBERT
1932,4.2.264,"And you have slander'd nature in my form,",HUBERT
1933,4.2.265,"Which, howsoever rude exteriorly,",HUBERT
1934,4.2.266,Is yet the cover of a fairer mind,HUBERT
1935,4.2.267,Than to be butcher of an innocent child.,HUBERT
1936,4.2.268,"Doth Arthur live? O, haste thee to the peers,",KING JOHN
1937,4.2.269,"Throw this report on their incensed rage,",KING JOHN
1938,4.2.270,And make them tame to their obedience!,KING JOHN
1939,4.2.271,Forgive the comment that my passion made,KING JOHN
1940,4.2.272,"Upon thy feature; for my rage was blind,",KING JOHN
1941,4.2.273,And foul imaginary eyes of blood,KING JOHN
1942,4.2.274,Presented thee more hideous than thou art.,KING JOHN
1943,4.2.275,"O, answer not, but to my closet bring",KING JOHN
1944,4.2.276,The angry lords with all expedient haste.,KING JOHN
1945,4.2.277,I conjure thee but slowly; run more fast.,KING JOHN
1946,4.3.1,"The wall is high, and yet will I leap down:",ARTHUR
1947,4.3.2,"Good ground, be pitiful and hurt me not!",ARTHUR
1948,4.3.3,"There's few or none do know me: if they did,",ARTHUR
1949,4.3.4,This ship-boy's semblance hath disguised me quite.,ARTHUR
1950,4.3.5,I am afraid; and yet I'll venture it.,ARTHUR
1951,4.3.6,"If I get down, and do not break my limbs,",ARTHUR
1952,4.3.7,I'll find a thousand shifts to get away:,ARTHUR
1953,4.3.8,"As good to die and go, as die and stay.",ARTHUR
1954,4.3.9,O me! my uncle's spirit is in these stones:,ARTHUR
1955,4.3.10,"Heaven take my soul, and England keep my bones!",ARTHUR
1956,4.3.11,"Lords, I will meet him at Saint Edmundsbury:",SALISBURY
1957,4.3.12,"It is our safety, and we must embrace",SALISBURY
1958,4.3.13,This gentle offer of the perilous time.,SALISBURY
1959,4.3.14,Who brought that letter from the cardinal?,PEMBROKE
1960,4.3.15,"The Count Melun, a noble lord of France,",SALISBURY
1961,4.3.16,Whose private with me of the Dauphin's love,SALISBURY
1962,4.3.17,Is much more general than these lines import.,SALISBURY
1963,4.3.18,To-morrow morning let us meet him then.,BIGOT
1964,4.3.19,Or rather then set forward; for 'twill be,SALISBURY
1965,4.3.20,"Two long days' journey, lords, or ere we meet.",SALISBURY
1966,4.3.21,"Once more to-day well met, distemper'd lords!",BASTARD
1967,4.3.22,The king by me requests your presence straight.,BASTARD
1968,4.3.23,The king hath dispossess'd himself of us:,SALISBURY
1969,4.3.24,We will not line his thin bestained cloak,SALISBURY
1970,4.3.25,"With our pure honours, nor attend the foot",SALISBURY
1971,4.3.26,That leaves the print of blood where'er it walks.,SALISBURY
1972,4.3.27,Return and tell him so: we know the worst.,SALISBURY
1973,4.3.28,"Whate'er you think, good words, I think, were best.",BASTARD
1974,4.3.29,"Our griefs, and not our manners, reason now.",SALISBURY
1975,4.3.30,But there is little reason in your grief;,BASTARD
1976,4.3.31,Therefore 'twere reason you had manners now.,BASTARD
1977,4.3.32,"Sir, sir, impatience hath his privilege.",PEMBROKE
1978,4.3.33,"'Tis true, to hurt his master, no man else.",BASTARD
1979,4.3.34,This is the prison. What is he lies here?,SALISBURY
1980,4.3.35,"O death, made proud with pure and princely beauty!",PEMBROKE
1981,4.3.36,The earth had not a hole to hide this deed.,PEMBROKE
1982,4.3.37,"Murder, as hating what himself hath done,",SALISBURY
1983,4.3.38,Doth lay it open to urge on revenge.,SALISBURY
1984,4.3.39,"Or, when he doom'd this beauty to a grave,",BIGOT
1985,4.3.40,Found it too precious-princely for a grave.,BIGOT
1986,4.3.41,"Sir Richard, what think you? have you beheld,",SALISBURY
1987,4.3.42,Or have you read or heard? or could you think?,SALISBURY
1988,4.3.43,"Or do you almost think, although you see,",SALISBURY
1989,4.3.44,"That you do see? could thought, without this object,",SALISBURY
1990,4.3.45,"Form such another? This is the very top,",SALISBURY
1991,4.3.46,"The height, the crest, or crest unto the crest,",SALISBURY
1992,4.3.47,"Of murder's arms: this is the bloodiest shame,",SALISBURY
1993,4.3.48,"The wildest savagery, the vilest stroke,",SALISBURY
1994,4.3.49,That ever wall-eyed wrath or staring rage,SALISBURY
1995,4.3.50,Presented to the tears of soft remorse.,SALISBURY
1996,4.3.51,All murders past do stand excused in this:,PEMBROKE
1997,4.3.52,"And this, so sole and so unmatchable,",PEMBROKE
1998,4.3.53,"Shall give a holiness, a purity,",PEMBROKE
1999,4.3.54,To the yet unbegotten sin of times;,PEMBROKE
2000,4.3.55,"And prove a deadly bloodshed but a jest,",PEMBROKE
