,LineNos,Lines,Speakers
1722,4.3.28,And of how coward a spirit.,DIONYZA
1723,4.3.29,To such proceeding,CLEON
1724,4.3.30,"Who ever but his approbation added,",CLEON
1725,4.3.31,"Though not his prime consent, he did not flow",CLEON
1726,4.3.32,From honourable sources.,CLEON
1727,4.3.33,"Be it so, then:",DIONYZA
1728,4.3.34,"Yet none does know, but you, how she came dead,",DIONYZA
1729,4.3.35,"Nor none can know, Leonine being gone.",DIONYZA
1730,4.3.36,"She did disdain my child, and stood between",DIONYZA
1731,4.3.37,"Her and her fortunes: none would look on her,",DIONYZA
1732,4.3.38,But cast their gazes on Marina's face;,DIONYZA
1733,4.3.39,Whilst ours was blurted at and held a malkin,DIONYZA
1734,4.3.40,Not worth the time of day. It pierced me through;,DIONYZA
1735,4.3.41,"And though you call my course unnatural,",DIONYZA
1736,4.3.42,"You not your child well loving, yet I find",DIONYZA
1737,4.3.43,It greets me as an enterprise of kindness,DIONYZA
1738,4.3.44,Perform'd to your sole daughter.,DIONYZA
1739,4.3.45,Heavens forgive it!,CLEON
1740,4.3.46,"And as for Pericles,",DIONYZA
1741,4.3.47,"What should he say? We wept after her hearse,",DIONYZA
1742,4.3.48,And yet we mourn: her monument,DIONYZA
1743,4.3.49,"Is almost finish'd, and her epitaphs",DIONYZA
1744,4.3.50,In glittering golden characters express,DIONYZA
1745,4.3.51,"A general praise to her, and care in us",DIONYZA
1746,4.3.52,At whose expense 'tis done.,DIONYZA
1747,4.3.53,"Thou art like the harpy,",CLEON
1748,4.3.54,"Which, to betray, dost, with thine angel's face,",CLEON
1749,4.3.55,Seize with thine eagle's talons.,CLEON
1750,4.3.56,You are like one that superstitiously,DIONYZA
1751,4.3.57,Doth swear to the gods that winter kills the flies:,DIONYZA
1752,4.3.58,But yet I know you'll do as I advise.,DIONYZA
1753,4.3.59,SCENE IV:,DIONYZA
1754,4.3.60,"Thus time we waste, and longest leagues make short;",GOWER
1755,4.3.61,"Sail seas in cockles, have an wish but for't;",GOWER
1756,4.3.62,"Making, to take your imagination,",GOWER
1757,4.3.63,"From bourn to bourn, region to region.",GOWER
1758,4.3.64,"By you being pardon'd, we commit no crime",GOWER
1759,4.3.65,To use one language in each several clime,GOWER
1760,4.3.66,Where our scenes seem to live. I do beseech you,GOWER
1761,4.3.67,"To learn of me, who stand i' the gaps to teach you,",GOWER
1762,4.3.68,The stages of our story. Pericles,GOWER
1763,4.3.69,"Is now again thwarting the wayward seas,",GOWER
1764,4.3.70,Attended on by many a lord and knight.,GOWER
1765,4.3.71,"To see his daughter, all his life's delight.",GOWER
1766,4.3.72,"Old Escanes, whom Helicanus late",GOWER
1767,4.3.73,"Advanced in time to great and high estate,",GOWER
1768,4.3.74,"Is left to govern. Bear you it in mind,",GOWER
1769,4.3.75,Old Helicanus goes along behind.,GOWER
1770,4.3.76,Well-sailing ships and bounteous winds have brought,GOWER
1771,4.3.77,"This king to Tarsus,--think his pilot thought;",GOWER
1772,4.3.78,"So with his steerage shall your thoughts grow on,--",GOWER
1773,4.3.79,"To fetch his daughter home, who first is gone.",GOWER
1774,4.3.80,Like motes and shadows see them move awhile;,GOWER
1775,4.3.81,Your ears unto your eyes I'll reconcile.,GOWER
1776,4.3.82,DUMB SHOW.,GOWER
1777,4.3.83,See how belief may suffer by foul show!,GOWER
1778,4.3.84,This borrow'd passion stands for true old woe;,GOWER
1779,4.3.85,"And Pericles, in sorrow all devour'd,",GOWER
1780,4.3.86,"With sighs shot through, and biggest tears",GOWER
1781,4.3.87,"o'ershower'd,",GOWER
1782,4.3.88,Leaves Tarsus and again embarks. He swears,GOWER
1783,4.3.89,"Never to wash his face, nor cut his hairs:",GOWER
1784,4.3.90,"He puts on sackcloth, and to sea. He bears",GOWER
1785,4.3.91,"A tempest, which his mortal vessel tears,",GOWER
1786,4.3.92,And yet he rides it out. Now please you wit.,GOWER
1787,4.3.93,The epitaph is for Marina writ,GOWER
1788,4.3.94,By wicked Dionyza.,GOWER
1789,4.3.95,"'The fairest, sweet'st, and best lies here,",GOWER
1790,4.3.96,Who wither'd in her spring of year.,GOWER
1791,4.3.97,"She was of Tyrus the king's daughter,",GOWER
1792,4.3.98,On whom foul death hath made this slaughter;,GOWER
1793,4.3.99,"Marina was she call'd; and at her birth,",GOWER
1794,4.3.100,"Thetis, being proud, swallow'd some part o' the earth:",GOWER
1795,4.3.101,"Therefore the earth, fearing to be o'erflow'd,",GOWER
1796,4.3.102,Hath Thetis' birth-child on the heavens bestow'd:,GOWER
1797,4.3.103,"Wherefore she does, and swears she'll never stint,",GOWER
1798,4.3.104,Make raging battery upon shores of flint.',GOWER
1799,4.3.105,No visor does become black villany,GOWER
1800,4.3.106,So well as soft and tender flattery.,GOWER
1801,4.3.107,"Let Pericles believe his daughter's dead,",GOWER
1802,4.3.108,And bear his courses to be ordered,GOWER
1803,4.3.109,By Lady Fortune; while our scene must play,GOWER
1804,4.3.110,His daughter's woe and heavy well-a-day,GOWER
1805,4.3.111,"In her unholy service. Patience, then,",GOWER
1806,4.3.112,And think you now are all in Mytilene.,GOWER
1807,4.5.1,Did you ever hear the like?,First Gentleman
1808,4.5.2,"No, nor never shall do in such a place as this, she",Second Gentleman
1809,4.5.3,being once gone.,Second Gentleman
1810,4.5.4,But to have divinity preached there! did you ever,First Gentleman
1811,4.5.5,dream of such a thing?,First Gentleman
1812,4.5.6,"No, no. Come, I am for no more bawdy-houses:",Second Gentleman
1813,4.5.7,shall's go hear the vestals sing?,Second Gentleman
1814,4.5.8,I'll do any thing now that is virtuous; but I,First Gentleman
1815,4.5.9,am out of the road of rutting for ever.,First Gentleman
1816,4.6.1,"Well, I had rather than twice the worth of her she",Pandar
1817,4.6.2,had ne'er come here.,Pandar
1818,4.6.3,"Fie, fie upon her! she's able to freeze the god",Bawd
1819,4.6.4,"Priapus, and undo a whole generation. We must",Bawd
1820,4.6.5,"either get her ravished, or be rid of her. When she",Bawd
1821,4.6.6,"should do for clients her fitment, and do me the",Bawd
1822,4.6.7,"kindness of our profession, she has me her quirks,",Bawd
1823,4.6.8,"her reasons, her master reasons, her prayers, her",Bawd
1824,4.6.9,"knees; that she would make a puritan of the devil,",Bawd
1825,4.6.10,if he should cheapen a kiss of her.,Bawd
1826,4.6.11,"'Faith, I must ravish her, or she'll disfurnish us",BOULT
1827,4.6.12,"of all our cavaliers, and make our swearers priests.",BOULT
1828,4.6.13,"Now, the pox upon her green-sickness for me!",Pandar
1829,4.6.14,"'Faith, there's no way to be rid on't but by the",Bawd
1830,4.6.15,way to the pox. Here comes the Lord Lysimachus disguised.,Bawd
1831,4.6.16,"We should have both lord and lown, if the peevish",BOULT
1832,4.6.17,baggage would but give way to customers.,BOULT
1833,4.6.18,How now! How a dozen of virginities?,LYSIMACHUS
1834,4.6.19,"Now, the gods to-bless your honour!",Bawd
1835,4.6.20,I am glad to see your honour in good health.,BOULT
1836,4.6.21,You may so; 'tis the better for you that your,LYSIMACHUS
1837,4.6.22,resorters stand upon sound legs. How now!,LYSIMACHUS
1838,4.6.23,wholesome iniquity have you that a man may deal,LYSIMACHUS
1839,4.6.24,"withal, and defy the surgeon?",LYSIMACHUS
1840,4.6.25,"We have here one, sir, if she would--but there never",Bawd
1841,4.6.26,came her like in Mytilene.,Bawd
1842,4.6.27,"If she'ld do the deed of darkness, thou wouldst say.",LYSIMACHUS
1843,4.6.28,Your honour knows what 'tis to say well enough.,Bawd
1844,4.6.29,"Well, call forth, call forth.",LYSIMACHUS
1845,4.6.30,"For flesh and blood, sir, white and red, you shall",BOULT
1846,4.6.31,"see a rose; and she were a rose indeed, if she had but--",BOULT
1847,4.6.32,"What, prithee?",LYSIMACHUS
1848,4.6.33,"O, sir, I can be modest.",BOULT
1849,4.6.34,"That dignifies the renown of a bawd, no less than it",LYSIMACHUS
1850,4.6.35,gives a good report to a number to be chaste.,LYSIMACHUS
1851,4.6.36,Here comes that which grows to the stalk; never,Bawd
1852,4.6.37,"plucked yet, I can assure you.",Bawd
1853,4.6.38,Is she not a fair creature?,Bawd
1854,4.6.39,"'Faith, she would serve after a long voyage at sea.",LYSIMACHUS
1855,4.6.40,"Well, there's for you: leave us.",LYSIMACHUS
1856,4.6.41,"I beseech your honour, give me leave: a word, and",Bawd
1857,4.6.42,I'll have done presently.,Bawd
1858,4.6.43,"I beseech you, do.",LYSIMACHUS
1859,4.6.44,"[To MARINA]  First, I would have you note, this is",Bawd
1860,4.6.45,an honourable man.,Bawd
1861,4.6.46,"I desire to find him so, that I may worthily note him.",MARINA
1862,4.6.47,"Next, he's the governor of this country, and a man",Bawd
1863,4.6.48,whom I am bound to.,Bawd
1864,4.6.49,"If he govern the country, you are bound to him",MARINA
1865,4.6.50,"indeed; but how honourable he is in that, I know not.",MARINA
1866,4.6.51,"Pray you, without any more virginal fencing, will",Bawd
1867,4.6.52,you use him kindly? He will line your apron with gold.,Bawd
1868,4.6.53,"What he will do graciously, I will thankfully receive.",MARINA
1869,4.6.54,Ha' you done?,LYSIMACHUS
1870,4.6.55,"My lord, she's not paced yet: you must take some",Bawd
1871,4.6.56,"pains to work her to your manage. Come, we will",Bawd
1872,4.6.57,leave his honour and her together. Go thy ways.,Bawd
1873,4.6.58,"Now, pretty one, how long have you been at this trade?",LYSIMACHUS
1874,4.6.59,"What trade, sir?",MARINA
1875,4.6.60,"Why, I cannot name't but I shall offend.",LYSIMACHUS
1876,4.6.61,I cannot be offended with my trade. Please you to name it.,MARINA
1877,4.6.62,How long have you been of this profession?,LYSIMACHUS
1878,4.6.63,E'er since I can remember.,MARINA
1879,4.6.64,Did you go to 't so young? Were you a gamester at,LYSIMACHUS
1880,4.6.65,five or at seven?,LYSIMACHUS
1881,4.6.66,"Earlier too, sir, if now I be one.",MARINA
1882,4.6.67,"Why, the house you dwell in proclaims you to be a",LYSIMACHUS
1883,4.6.68,creature of sale.,LYSIMACHUS
1884,4.6.69,"Do you know this house to be a place of such resort,",MARINA
1885,4.6.70,and will come into 't? I hear say you are of,MARINA
1886,4.6.71,"honourable parts, and are the governor of this place.",MARINA
1887,4.6.72,"Why, hath your principal made known unto you who I am?",LYSIMACHUS
1888,4.6.73,Who is my principal?,MARINA
1889,4.6.74,"Why, your herb-woman; she that sets seeds and roots",LYSIMACHUS
1890,4.6.75,"of shame and iniquity. O, you have heard something",LYSIMACHUS
1891,4.6.76,"of my power, and so stand aloof for more serious",LYSIMACHUS
1892,4.6.77,"wooing. But I protest to thee, pretty one, my",LYSIMACHUS
1893,4.6.78,"authority shall not see thee, or else look friendly",LYSIMACHUS
1894,4.6.79,"upon thee. Come, bring me to some private place:",LYSIMACHUS
1895,4.6.80,"come, come.",LYSIMACHUS
1896,4.6.81,"If you were born to honour, show it now;",MARINA
1897,4.6.82,"If put upon you, make the judgment good",MARINA
1898,4.6.83,That thought you worthy of it.,MARINA
1899,4.6.84,How's this? how's this? Some more; be sage.,LYSIMACHUS
1900,4.6.85,"For me,",MARINA
1901,4.6.86,"That am a maid, though most ungentle fortune",MARINA
1902,4.6.87,"Have placed me in this sty, where, since I came,",MARINA
1903,4.6.88,"Diseases have been sold dearer than physic,",MARINA
1904,4.6.89,"O, that the gods",MARINA
1905,4.6.90,"Would set me free from this unhallow'd place,",MARINA
1906,4.6.91,Though they did change me to the meanest bird,MARINA
1907,4.6.92,That flies i' the purer air!,MARINA
1908,4.6.93,I did not think,LYSIMACHUS
1909,4.6.94,Thou couldst have spoke so well; ne'er dream'd thou couldst.,LYSIMACHUS
1910,4.6.95,"Had I brought hither a corrupted mind,",LYSIMACHUS
1911,4.6.96,"Thy speech had alter'd it. Hold, here's gold for thee:",LYSIMACHUS
1912,4.6.97,"Persever in that clear way thou goest,",LYSIMACHUS
1913,4.6.98,And the gods strengthen thee!,LYSIMACHUS
1914,4.6.99,The good gods preserve you!,MARINA
1915,4.6.100,"For me, be you thoughten",LYSIMACHUS
1916,4.6.101,That I came with no ill intent; for to me,LYSIMACHUS
1917,4.6.102,The very doors and windows savour vilely.,LYSIMACHUS
1918,4.6.103,"Fare thee well. Thou art a piece of virtue, and",LYSIMACHUS
1919,4.6.104,I doubt not but thy training hath been noble.,LYSIMACHUS
1920,4.6.105,"Hold, here's more gold for thee.",LYSIMACHUS
1921,4.6.106,"A curse upon him, die he like a thief,",LYSIMACHUS
1922,4.6.107,That robs thee of thy goodness! If thou dost,LYSIMACHUS
1923,4.6.108,"Hear from me, it shall be for thy good.",LYSIMACHUS
1924,4.6.109,"I beseech your honour, one piece for me.",BOULT
1925,4.6.110,"Avaunt, thou damned door-keeper!",LYSIMACHUS
1926,4.6.111,"Your house, but for this virgin that doth prop it,",LYSIMACHUS
1927,4.6.112,Would sink and overwhelm you. Away!,LYSIMACHUS
1928,4.6.113,How's this? We must take another course with you.,BOULT
1929,4.6.114,"If your peevish chastity, which is not worth a",BOULT
1930,4.6.115,"breakfast in the cheapest country under the cope,",BOULT
1931,4.6.116,"shall undo a whole household, let me be gelded like",BOULT
1932,4.6.117,a spaniel. Come your ways.,BOULT
1933,4.6.118, Whither would you have me?,MARINA
1934,4.6.119,"I must have your maidenhead taken off, or the common",BOULT
1935,4.6.120,hangman shall execute it. Come your ways. We'll,BOULT
1936,4.6.121,"have no more gentlemen driven away. Come your ways, I say.",BOULT
1937,4.6.122,How now! what's the matter?,Bawd
1938,4.6.123,"Worse and worse, mistress; she has here spoken holy",BOULT
1939,4.6.124,words to the Lord Lysimachus.,BOULT
1940,4.6.125,O abominable!,Bawd
1941,4.6.126,She makes our profession as it were to stink afore,BOULT
1942,4.6.127,the face of the gods.,BOULT
1943,4.6.128,"Marry, hang her up for ever!",Bawd
1944,4.6.129,The nobleman would have dealt with her like a,BOULT
1945,4.6.130,"nobleman, and she sent him away as cold as a",BOULT
1946,4.6.131,snowball; saying his prayers too.,BOULT
1947,4.6.132,"Boult, take her away; use her at thy pleasure:",Bawd
1948,4.6.133,"crack the glass of her virginity, and make the rest malleable.",Bawd
1949,4.6.134,An if she were a thornier piece of ground than she,BOULT
1950,4.6.135,"is, she shall be ploughed.",BOULT
1951,4.6.136,"Hark, hark, you gods!",MARINA
1952,4.6.137,She conjures: away with her! Would she had never,Bawd
1953,4.6.138,"come within my doors! Marry, hang you! She's born",Bawd
1954,4.6.139,to undo us. Will you not go the way of women-kind?,Bawd
1955,4.6.140,"Marry, come up, my dish of chastity with rosemary and bays!",Bawd
1956,4.6.141,"Come, mistress; come your ways with me.",BOULT
1957,4.6.142,Whither wilt thou have me?,MARINA
1958,4.6.143,To take from you the jewel you hold so dear.,BOULT
1959,4.6.144,"Prithee, tell me one thing first.",MARINA
1960,4.6.145,"Come now, your one thing.",BOULT
1961,4.6.146,What canst thou wish thine enemy to be?,MARINA
1962,4.6.147,"Why, I could wish him to be my master, or rather, my mistress.",BOULT
1963,4.6.148,"Neither of these are so bad as thou art,",MARINA
1964,4.6.149,Since they do better thee in their command.,MARINA
1965,4.6.150,"Thou hold'st a place, for which the pained'st fiend",MARINA
1966,4.6.151,Of hell would not in reputation change:,MARINA
1967,4.6.152,Thou art the damned doorkeeper to every,MARINA
1968,4.6.153,Coistrel that comes inquiring for his Tib;,MARINA
1969,4.6.154,To the choleric fisting of every rogue,MARINA
1970,4.6.155,Thy ear is liable; thy food is such,MARINA
1971,4.6.156,As hath been belch'd on by infected lungs.,MARINA
1972,4.6.157,"What would you have me do? go to the wars, would",BOULT
1973,4.6.158,you? where a man may serve seven years for the loss,BOULT
1974,4.6.159,"of a leg, and have not money enough in the end to",BOULT
1975,4.6.160,buy him a wooden one?,BOULT
1976,4.6.161,Do any thing but this thou doest. Empty,MARINA
1977,4.6.162,"OLD receptacles, or common shores, of filth;",MARINA
1978,4.6.163,Serve by indenture to the common hangman:,MARINA
1979,4.6.164,Any of these ways are yet better than this;,MARINA
1980,4.6.165,"For what thou professest, a baboon, could he speak,",MARINA
1981,4.6.166,"Would own a name too dear. O, that the gods",MARINA
1982,4.6.167,Would safely deliver me from this place!,MARINA
1983,4.6.168,"Here, here's gold for thee.",MARINA
1984,4.6.169,"If that thy master would gain by thee,",MARINA
1985,4.6.170,"Proclaim that I can sing, weave, sew, and dance,",MARINA
1986,4.6.171,"With other virtues, which I'll keep from boast:",MARINA
1987,4.6.172,And I will undertake all these to teach.,MARINA
1988,4.6.173,I doubt not but this populous city will,MARINA
1989,4.6.174,Yield many scholars.,MARINA
1990,4.6.175,But can you teach all this you speak of?,BOULT
1991,4.6.176,"Prove that I cannot, take me home again,",MARINA
1992,4.6.177,And prostitute me to the basest groom,MARINA
1993,4.6.178,That doth frequent your house.,MARINA
1994,4.6.179,"Well, I will see what I can do for thee: if I can",BOULT
1995,4.6.180,"place thee, I will.",BOULT
1996,4.6.181,But amongst honest women.,MARINA
1997,4.6.182,"'Faith, my acquaintance lies little amongst them.",BOULT
1998,4.6.183,"But since my master and mistress have bought you,",BOULT
1999,4.6.184,there's no going but by their consent: therefore I,BOULT
2000,4.6.185,"will make them acquainted with your purpose, and I",BOULT
2001,4.6.186,doubt not but I shall find them tractable enough.,BOULT
2002,4.6.187,"Come, I'll do for thee what I can; come your ways.",BOULT
2003,5.6.188,"Marina thus the brothel 'scapes, and chances",GOWER
2004,5.6.189,"Into an honest house, our story says.",GOWER
2005,5.6.190,"She sings like one immortal, and she dances",GOWER
2006,5.6.191,As goddess-like to her admired lays;,GOWER
2007,5.6.192,Deep clerks she dumbs; and with her needle composes,GOWER
2008,5.6.193,"Nature's own shape, of bud, bird, branch, or berry,",GOWER
2009,5.6.194,That even her art sisters the natural roses;,GOWER
2010,5.6.195,"Her inkle, silk, twin with the rubied cherry:",GOWER
2011,5.6.196,"That pupils lacks she none of noble race,",GOWER
2012,5.6.197,Who pour their bounty on her; and her gain,GOWER
2013,5.6.198,She gives the cursed bawd. Here we her place;,GOWER
2014,5.6.199,"And to her father turn our thoughts again,",GOWER
2015,5.6.200,"Where we left him, on the sea. We there him lost;",GOWER
2016,5.6.201,"Whence, driven before the winds, he is arrived",GOWER
2017,5.6.202,Here where his daughter dwells; and on this coast,GOWER
2018,5.6.203,Suppose him now at anchor. The city strived,GOWER
2019,5.6.204,God Neptune's annual feast to keep: from whence,GOWER
2020,5.6.205,"Lysimachus our Tyrian ship espies,",GOWER
2021,5.6.206,"His banners sable, trimm'd with rich expense;",GOWER
2022,5.6.207,And to him in his barge with fervor hies.,GOWER
2023,5.6.208,In your supposing once more put your sight,GOWER
2024,5.6.209,Of heavy Pericles; think this his bark:,GOWER
2025,5.6.210,"Where what is done in action, more, if might,",GOWER
2026,5.6.211,"Shall be discover'd; please you, sit and hark.",GOWER
2027,5.1.1,"pavilion on deck, with a curtain before it; PERICLES",GOWER
2028,5.1.2,"within it, reclined on a couch. A barge lying",GOWER
2029,5.1.3,beside the Tyrian vessel.,GOWER
2030,5.1.4,[To the Sailor of Mytilene]  Where is lord Helicanus?,Tyrian Sailor
2031,5.1.5,he can resolve you.,Tyrian Sailor
2032,5.1.6,"O, here he is.",Tyrian Sailor
2033,5.1.7,"Sir, there's a barge put off from Mytilene,",Tyrian Sailor
2034,5.1.8,"And in it is Lysimachus the governor,",Tyrian Sailor
2035,5.1.9,Who craves to come aboard. What is your will?,Tyrian Sailor
2036,5.1.10,That he have his. Call up some gentlemen.,HELICANUS
2037,5.1.11,"Ho, gentlemen! my lord calls.",Tyrian Sailor
2038,5.1.12,Doth your lordship call?,First Gentleman
2039,5.1.13,"Gentlemen, there's some of worth would come aboard;",HELICANUS
2040,5.1.14,"I pray ye, greet them fairly.",HELICANUS
2041,5.1.15,"Sir,",Tyrian Sailor
2042,5.1.16,"This is the man that can, in aught you would,",Tyrian Sailor
2043,5.1.17,Resolve you.,Tyrian Sailor
2044,5.1.18,"Hail, reverend sir! the gods preserve you!",LYSIMACHUS
2045,5.1.19,"And you, sir, to outlive the age I am,",HELICANUS
2046,5.1.20,And die as I would do.,HELICANUS
2047,5.1.21,You wish me well.,LYSIMACHUS
2048,5.1.22,"Being on shore, honouring of Neptune's triumphs,",LYSIMACHUS
2049,5.1.23,"Seeing this goodly vessel ride before us,",LYSIMACHUS
2050,5.1.24,"I made to it, to know of whence you are.",LYSIMACHUS
2051,5.1.25,"First, what is your place?",HELICANUS
2052,5.1.26,I am the governor of this place you lie before.,LYSIMACHUS
2053,5.1.27,"Sir,",HELICANUS
2054,5.1.28,"Our vessel is of Tyre, in it the king;",HELICANUS
2055,5.1.29,A man who for this three months hath not spoken,HELICANUS
2056,5.1.30,"To any one, nor taken sustenance",HELICANUS
2057,5.1.31,But to prorogue his grief.,HELICANUS
2058,5.1.32,Upon what ground is his distemperature?,LYSIMACHUS
2059,5.1.33,'Twould be too tedious to repeat;,HELICANUS
2060,5.1.34,But the main grief springs from the loss,HELICANUS
2061,5.1.35,Of a beloved daughter and a wife.,HELICANUS
2062,5.1.36,May we not see him?,LYSIMACHUS
2063,5.1.37,You may;,HELICANUS
2064,5.1.38,But bootless is your sight: he will not speak To any.,HELICANUS
2065,5.1.39,Yet let me obtain my wish.,LYSIMACHUS
2066,5.1.40,Behold him.,HELICANUS
2067,5.1.41,"This was a goodly person,",HELICANUS
2068,5.1.42,"Till the disaster that, one mortal night,",HELICANUS
2069,5.1.43,Drove him to this.,HELICANUS
2070,5.1.44,"Sir king, all hail! the gods preserve you!",LYSIMACHUS
2071,5.1.45,"Hail, royal sir!",LYSIMACHUS
2072,5.1.46,It is in vain; he will not speak to you.,HELICANUS
2073,5.1.47,"Sir,",First Lord
2074,5.1.48,"We have a maid in Mytilene, I durst wager,",First Lord
2075,5.1.49,Would win some words of him.,First Lord
2076,5.1.50,'Tis well bethought.,LYSIMACHUS
2077,5.1.51,She questionless with her sweet harmony,LYSIMACHUS
2078,5.1.52,"And other chosen attractions, would allure,",LYSIMACHUS
2079,5.1.53,"And make a battery through his deafen'd parts,",LYSIMACHUS
2080,5.1.54,Which now are midway stopp'd:,LYSIMACHUS
2081,5.1.55,"She is all happy as the fairest of all,",LYSIMACHUS
2082,5.1.56,"And, with her fellow maids is now upon",LYSIMACHUS
2083,5.1.57,The leafy shelter that abuts against,LYSIMACHUS
2084,5.1.58,The island's side.,LYSIMACHUS
2085,5.1.59,"Sure, all's effectless; yet nothing we'll omit",HELICANUS
2086,5.1.60,"That bears recovery's name. But, since your kindness",HELICANUS
2087,5.1.61,"We have stretch'd thus far, let us beseech you",HELICANUS
2088,5.1.62,"That for our gold we may provision have,",HELICANUS
2089,5.1.63,"Wherein we are not destitute for want,",HELICANUS
2090,5.1.64,But weary for the staleness.,HELICANUS
2091,5.1.65,"O, sir, a courtesy",LYSIMACHUS
2092,5.1.66,"Which if we should deny, the most just gods",LYSIMACHUS
2093,5.1.67,"For every graff would send a caterpillar,",LYSIMACHUS
2094,5.1.68,And so afflict our province. Yet once more,LYSIMACHUS
2095,5.1.69,Let me entreat to know at large the cause,LYSIMACHUS
2096,5.1.70,Of your king's sorrow.,LYSIMACHUS
2097,5.1.71,"Sit, sir, I will recount it to you:",HELICANUS
2098,5.1.72,"But, see, I am prevented.",HELICANUS
2099,5.1.73,"O, here is",LYSIMACHUS
2100,5.1.74,"The lady that I sent for. Welcome, fair one!",LYSIMACHUS
2101,5.1.75,Is't not a goodly presence?,LYSIMACHUS
2102,5.1.76,She's a gallant lady.,HELICANUS
2103,5.1.77,"She's such a one, that, were I well assured",LYSIMACHUS
2104,5.1.78,"Came of a gentle kind and noble stock,",LYSIMACHUS
2105,5.1.79,"I'ld wish no better choice, and think me rarely wed.",LYSIMACHUS
2106,5.1.80,"Fair one, all goodness that consists in bounty",LYSIMACHUS
2107,5.1.81,"Expect even here, where is a kingly patient:",LYSIMACHUS
2108,5.1.82,If that thy prosperous and artificial feat,LYSIMACHUS
2109,5.1.83,"Can draw him but to answer thee in aught,",LYSIMACHUS
2110,5.1.84,Thy sacred physic shall receive such pay,LYSIMACHUS
2111,5.1.85,As thy desires can wish.,LYSIMACHUS
2112,5.1.86,"Sir, I will use",MARINA
2113,5.1.87,"My utmost skill in his recovery, Provided",MARINA
2114,5.1.88,That none but I and my companion maid,MARINA
2115,5.1.89,Be suffer'd to come near him.,MARINA
2116,5.1.90,"Come, let us leave her;",LYSIMACHUS
2117,5.1.91,And the gods make her prosperous!,LYSIMACHUS
2118,5.1.92,Mark'd he your music?,LYSIMACHUS
2119,5.1.93,"No, nor look'd on us.",MARINA
2120,5.1.94,"See, she will speak to him.",LYSIMACHUS
2121,5.1.95,"Hail, sir! my lord, lend ear.",MARINA
2122,5.1.96,"Hum, ha!",PERICLES
2123,5.1.97,"I am a maid,",MARINA
2124,5.1.98,"My lord, that ne'er before invited eyes,",MARINA
2125,5.1.99,"But have been gazed on like a comet: she speaks,",MARINA
2126,5.1.100,"My lord, that, may be, hath endured a grief",MARINA
2127,5.1.101,"Might equal yours, if both were justly weigh'd.",MARINA
2128,5.1.102,"Though wayward fortune did malign my state,",MARINA
2129,5.1.103,My derivation was from ancestors,MARINA
2130,5.1.104,Who stood equivalent with mighty kings:,MARINA
2131,5.1.105,"But time hath rooted out my parentage,",MARINA
2132,5.1.106,And to the world and awkward casualties,MARINA
2133,5.1.107,Bound me in servitude.,MARINA
2134,5.1.108,I will desist;,MARINA
2135,5.1.109,"But there is something glows upon my cheek,",MARINA
2136,5.1.110,"And whispers in mine ear, 'Go not till he speak.'",MARINA
2137,5.1.111,My fortunes--parentage--good parentage--,PERICLES
2138,5.1.112,To equal mine!--was it not thus? what say you?,PERICLES
2139,5.1.113,"I said, my lord, if you did know my parentage,",MARINA
2140,5.1.114,You would not do me violence.,MARINA
2141,5.1.115,"I do think so. Pray you, turn your eyes upon me.",PERICLES
2142,5.1.116,You are like something that--What country-woman?,PERICLES
2143,5.1.117,Here of these shores?,PERICLES
2144,5.1.118,"No, nor of any shores:",MARINA
2145,5.1.119,"Yet I was mortally brought forth, and am",MARINA
2146,5.1.120,No other than I appear.,MARINA
2147,5.1.121,"I am great with woe, and shall deliver weeping.",PERICLES
2148,5.1.122,"My dearest wife was like this maid, and such a one",PERICLES
2149,5.1.123,My daughter might have been: my queen's square brows;,PERICLES
